05418500	13375649	Maquoketa River near Maquoketa, IA
05418720	13375515	Maquoketa River near Green Island, IA
05419000	13361516	APPLE RIVER NEAR HANOVER, IL
05420500	14809371	Mississippi River at Clinton, IA
05420680	6949292	Wapsipinicon River near Tripoli, IA
05421000	6950974	Wapsipinicon River at Independence, IA
05421682	6950486	Buffalo Creek South of Prairieburg, IA
05421740	14794879	Wapsipinicon River near Anamosa, IA
05421760	14795283	Wapsipinicon River at Oxford Mills, IA
05422000	14796105	Wapsipinicon River near De Witt, IA
05422560	14803953	Duck Creek at 110th Avenue at Davenport, IA
05422600	14804277	Duck Creek at DC Golf Course at Davenport, IA
05423500	13290352	SOUTH BRANCH ROCK RIVER AT WAUPUN, WI
05424057	13292206	ROCK RIVER AT HORICON, WI
05425500	13292712	ROCK RIVER AT WATERTOWN, WI
05425912	13282922	BEAVERDAM RIVER AT BEAVER DAM, WI
05426000	13283852	CRAWFISH RIVER AT MILFORD, WI
05426067	13291814	BARK RIVER AT NAGAWICKA ROAD AT DELAFIELD, WI
05426250	13295168	BARK RIVER NEAR ROME, WI
05427085	13296176	ROCK RIVER AT FORT ATKINSON, WI
05427530	13297220	ROCK RIVER AT NEWVILLE, WI
05427718	13293430	YAHARA RIVER AT WINDSOR, WI
05427850	13293576	YAHARA RIVER AT STATE HIGHWAY 113 AT MADISON, WI
05427880	13294132	SIXMILE CREEK AT STATE HIGHWAY 19 NEAR WAUNAKEE,WI
05427910	13294166	SIXMILE CREEK @ COUNTY TRNK HGHWY M NR WAUNAKEE,WI
05427927	13294176	DORN (SPRING) CREEK @ CT HIGHWAY Q NR WAUNAKEE, WI
05427943	13294264	PHEASANT BRANCH AT AIRPORT ROAD NEAR MIDDLETON, WI
05428500	13293750	YAHARA RIVER AT EAST MAIN STREET AT MADISON, WI
05429500	13293970	YAHARA RIVER AT MC FARLAND, WI
05429700	13297194	YAHARA RIVER @ FORTON STREET BRIDGE @ STOUGHTON,WI
05430150	13296760	BADFISH CREEK NEAR COOKSVILLE, WI
05430175	13296764	YAHARA RIVER NEAR FULTON, WI
05430500	13297290	ROCK RIVER AT AFTON, WI
05431016	13295584	JACKSON CREEK AT MOUND ROAD NEAR ELKHORN, WI
05431486	13295630	TURTLE CREEK AT CARVERS ROCK ROAD NEAR CLINTON, WI
05432500	13412928	PECATONICA RIVER AT DARLINGTON, WI
05432695	13409794	RIDGEWAY BRANCH NEAR HOLLANDALE, WI
05432927	13410000	PLEASANT VALLEY CREEK @ CTH H NR BLANCHARDVILLE,WI
05433000	13410230	EAST BRANCH PECATONICA RIVER NR BLANCHARDVILLE, WI
05434500	13411154	PECATONICA RIVER AT MARTINTOWN, WI
05435500	13414140	PECATONICA RIVER AT FREEPORT, IL
05435943	13425023	BADGER MILL CREEK AT VERONA, WI
05435950	13425065	SUGAR RIVER NEAR VERONA, WI
05436500	13425947	SUGAR RIVER NEAR BRODHEAD, WI
05437050	13418856	PECATONICA RIVER NR SHIRLAND, ILL
05437500	10603682	ROCK RIVER AT ROCKTON, IL
05438030	19285865	FRANKLINVILLE CREEK AT FRANKLINVILLE, IL
05438170	19285877	KISHWAUKEE RIVER AT MARENGO, IL
05438283	19285051	PISCASAW CREEK NEAR WALWORTH, WI
05438500	19285907	KISHWAUKEE RIVER AT BELVIDERE, IL
05439000	19287511	SOUTH BRANCH KISHWAUKEE RIVER AT DEKALB, IL
05439500	19286343	SOUTH BRANCH KISHWAUKEE RIVER NR FAIRDALE IL
05440000	19289305	KISHWAUKEE RIVER NEAR PERRYVILLE, IL
05440700	10603828	ROCK RIVER AT BYRON, IL
05442300	10607604	ROCK RIVER AT DIXON, IL
05443500	10607692	ROCK RIVER AT COMO, IL
05444000	10605920	ELKHORN CREEK NEAR PENROSE, IL
05446500	10608846	ROCK RIVER NEAR JOSLIN, IL
05447500	10969489	GREEN RIVER NEAR GENESEO, IL
05448000	10609240	MILL CREEK AT MILAN, IL
05449500	6570940	Iowa River near Rowan, IA
05451210	6572160	South Fork Iowa River NE of New Providence, IA
05451500	17539323	Iowa River at Marshalltown, IA
05451700	17539261	Timber Creek near Marshalltown, IA
05451770	17541397	Iowa River at County Highway E49 near Tama, IA
05451900	17541959	Richland Creek near Haven, IA
05452000	17543537	Salt Creek near Elberon, IA
05452200	17543587	Walnut Creek near Hartwick, IA
05452500	17543573	Iowa River near Belle Plaine, IA
05453000	17543645	Big Bear Creek at Ladora, IA
05453100	17543597	Iowa River at Marengo, IA
05453520	11916389	Iowa River below Coralville Dam nr Coralville, IA
05454000	11915429	Rapid Creek near Iowa City, IA
05454090	11915407	Muddy Creek at Coralville, IA
05454220	11915379	Clear Creek near Oxford, IA
05454300	11915507	Clear Creek near Coralville, IA
05454500	11916315	Iowa River at Iowa City, IA
05455100	11915787	Old Mans Creek near Iowa City, IA
05455500	11918423	English River at Kalona, IA
05455700	11919685	Iowa River near Lone Tree, IA
05457000	7014461	CEDAR RIVER NEAR AUSTIN, MN
05457505	7015937	Cedar River at Osage, IA
05457700	7016523	Cedar River at Charles City, IA
05458000	7016531	Little Cedar River near Ionia, IA
05458300	7017471	Cedar River at Waverly, IA
05458500	7017505	Cedar River at Janesville, IA
05458900	2165301	West Fork Cedar River at Finchford, IA
05459500	937080094	Winnebago River at Mason City, IA
05460400	6559411	Shell Rock River near Rockford, IA
05462000	6561217	Shell Rock River at Shell Rock, IA
05463000	22471721	Beaver Creek at New Hartford, IA
05463050	22472163	Cedar River at Cedar Falls, IA
05463500	22474681	Black Hawk Creek at Hudson, IA
05464000	937080146	Cedar River at Waterloo, IA
05464220	22476707	Wolf Creek near Dysart, IA
05464315	22477067	Cedar River at Vinton, IA
05464420	22473833	Cedar River at Blairs Ferry Road at Palo, IA
05464475	22477673	Morgan Creek near Covington, IA
05464500	22477695	Cedar River at Cedar Rapids, IA
05464730	17556771	Cedar River below Indian Creek at Cedar Rapids, IA
05464780	17556945	Cedar River at Cedar Bluff, IA
0546494170	17556267	WB Wapsinonoc Cr at College St at West Branch, IA
05464942	17556269	Hoover Cr at Hoover Nat Hist Site, West Branch, IA
05465000	17557695	Cedar River near Conesville, IA
05465500	11919825	Iowa River at Wapello, IA
05465700	11923655	Iowa River at Oakville, IA
05466000	6959569	EDWARDS RIVER NEAR ORION, IL
05466500	6960295	EDWARDS RIVER NEAR NEW BOSTON, IL
05467000	6960357	POPE CREEK NEAR KEITHSBURG, IL
05469000	6960893	HENDERSON CREEK NEAR OQUAWKA, IL
05470000	6978934	South Skunk River near Ames, IA
05470500	6979014	Ioway Creek at Ames, IA
05471000	6979048	South Skunk River below Ioway Creek near Ames, IA
05471050	6987834	South Skunk River at Colfax, IA
05471200	6981152	Indian Creek near Mingo, IA
05471500	6984030	South Skunk River near Oskaloosa, IA
05472500	6996297	North Skunk River near Sigourney, IA
05473065	7003858	Skunk River at Merrimac, IA
05473400	7005420	Cedar Creek near Oakland Mills, IA
05473450	7003470	Big Creek North of Mount Pleasant, IA
05474000	7006146	Skunk River at Augusta, IA
05476000	6580244	DES MOINES RIVER AT JACKSON, MN
05476590	6587221	Des Moines River at Emmetsburg, IA
05476750	6588281	Des Moines River at Humboldt, IA
05478265	6591302	East Fork Des Moines River near Algona, IA
05479000	6591838	East Fork Des Moines River at Dakota City, IA
05480500	6594454	Des Moines River at Fort Dodge, IA
05480820	6603048	Boone River near Goldfield, IA
05481000	6603910	Boone River near Webster City, IA
05481300	6595152	Des Moines River near Stratford, IA
05481650	6597718	Des Moines River near Saylorville, IA
05481950	6597300	Beaver Creek near Grimes, IA
05482000	6597748	Des Moines River at 2nd Avenue at Des Moines, IA
05482300	6608106	North Raccoon River near Sac City, IA
05482500	6610484	North Raccoon River near Jefferson, IA
05483450	6621598	Middle Raccoon River near Bayard, IA
05483600	6621656	Middle Raccoon River at Panora, IA
05484000	6621036	South Raccoon River at Redfield, IA
05484500	6610166	Raccoon River at Van Meter, IA
05484600	6610162	Raccoon River near West Des Moines, IA
05484650	6610248	Raccoon River at 63rd Street at Des Moines, IA
05484800	6609844	Walnut Creek at Des Moines, IA
05484900	6610140	Raccoon River at Fleur Drive at Des Moines, IA
05485500	22249381	Des Moines River blw Raccoon Riv at Des Moines, IA
05485605	22248777	Fourmile Creek near Ankeny, IA DS1
05485640	22248913	Fourmile Creek at Des Moines, IA
05486000	22250473	North River near Norwalk, IA
05486490	22253619	Middle River near Indianola, IA
05487470	22251347	South River near Ackworth, IA
05487520	22254205	Des Moines River near Swan, IA
05487980	22252001	White Breast Creek near Dallas, IA
05488110	4995175	Des Moines River near Pella, IA
05488200	4995875	English Creek near Knoxville, IA
05488500	4995213	Des Moines River near Tracy, IA
05489000	4994047	Cedar Creek near Bussey, IA
05489500	4995479	Des Moines River at Ottumwa, IA
05490500	4998271	Des Moines River at Keosauqua, IA
05490600	5002731	Des Moines River at St. Francisville, MO
05494300	5799184	Fox River at Bloomfield, IA
05495000	5802762	Fox River at Wayland, MO
05495500	5802188	BEAR CREEK NEAR MARCELLINE, IL
05496000	5802280	Wyaconda River above Canton, MO
05497150	5017066	North Fabius River near Ewing, MO
05498150	5017044	Middle Fabius River near Ewing, MO
05498700	4989089	South Fabius River above Newark, MO
05500000	4989635	South Fabius River near Taylor, MO
05501000	2925495	North River at Palmyra, MO
05502000	2926561	Bear Creek at Hannibal, MO
05502300	5640944	North Fork Salt River at Hagers Grove, MO
05502500	5641176	North Fork Salt River near Shelbina, MO
05503100	5640404	Black Creek below Shelbyville, MO
05503800	5640210	Crooked Creek near Paris, MO
05504800	5040010	South Fork Salt River above Santa Fe, MO
05506100	5039952	Long Branch near Santa Fe, MO
05506350	5039176	Middle Fork Salt River near Holliday, MO
05506800	5041944	Elk Fork Salt River near Madison, MO
05507600	4868933	Lick Creek at Perry, MO
05507800	4867791	Salt River near Center, MO
05508000	4867473	Salt River near New London, MO
05508805	4867221	Spencer Creek below Plum Creek near Frankford, MO
05512500	2924333	BAY CREEK AT PITTSFIELD, IL
05514500	2507315	Cuivre River near Troy, MO
05514840	880196	Dardenne Creek at O'Fallon, MO
05514860	880034	Dardenne Creek at Old Town St. Peters, MO
05515500	13433513	KANKAKEE RIVER AT DAVIS, IN
05516500	13435067	YELLOW RIVER AT PLYMOUTH, IN
05516665	13435155	YELLOW RIVER NEAR OAK GROVE, IN
05517000	13434009	YELLOW RIVER AT KNOX, IN
05517500	13434643	KANKAKEE RIVER AT DUNNS BRIDGE, IN
05517530	13437773	KANKAKEE RIVER NR KOUTS, IN
05518000	13438397	KANKAKEE RIVER AT SHELBY, IN
05520500	13438215	KANKAKEE RIVER AT MOMENCE, IL
05520980	13451750	IROQUOIS RIVER NEAR PARR, IN
05522500	13453074	IROQUOIS RIVER AT RENSSELAER, IN
05523865	13453702	CARPENTER CREEK AT REMINGTON, IN
05524500	13454468	IROQUOIS RIVER NEAR FORESMAN, IN
05524546	13453690	HUNTER DITCH AT GOODLAND, IN
05525000	13454484	IROQUOIS RIVER AT IROQUOIS, IL
05525500	13454068	SUGAR CREEK AT MILFORD, IL
05526000	13451894	IROQUOIS RIVER NEAR CHEBANSE, IL
05527500	13439203	KANKAKEE RIVER NEAR WILMINGTON, IL
05527800	14784427	DES PLAINES RIVER AT RUSSELL, IL
05527900	14785155	NORTH MILL CREEK AT HICKORY CORNERS, IL
05527905	14785175	HASTINGS CREEK NEAR LINDENHURST, IL
05527910	14785163	NORTH MILL CREEK NEAR MILBURN, IL
05527950	14784463	MILL CREEK AT OLD MILL CREEK, IL
05528000	14784503	DES PLAINES RIVER NEAR GURNEE, IL
05528100	14784669	DES PLAINES RIVER AT LINCOLNSHIRE, IL
05528500	14784601	BUFFALO CREEK NEAR WHEELING, IL
05529000	14784677	DES PLAINES RIVER NEAR DES PLAINES, IL
05529500	14784675	MC DONALD CREEK NEAR MOUNT PROSPECT, IL
05530100	14784647	DES PLAINES R AT ALGONQUIN RD AT DES PLAINES, IL
05530990	14785397	SALT CREEK AT ROLLING MEADOWS, IL
05531044	14785449	SALT CREEK NEAR ELK GROVE VILLAGE, IL
05531045	14785333	SALT CREEK AT ELK GROVE VILLAGE, IL
05531300	14785887	SALT CREEK AT ELMHURST, IL
05531500	14785933	SALT CREEK AT WESTERN SPRINGS, IL
05532000	14785903	ADDISON CREEK AT BELLWOOD, IL
05532500	14786231	DES PLAINES RIVER AT RIVERSIDE, IL
05533000	14785981	FLAG CREEK NEAR WILLOW SPRINGS, IL
05533400	14786309	SAWMILL CREEK NEAR LEMONT, IL
05533600	14787477	DES PLAINES RIVER NEAR LEMONT, IL
05534500	13463115	NORTH BRANCH CHICAGO RIVER AT DEERFIELD, IL
05535000	13463117	SKOKIE RIVER AT LAKE FOREST, IL
05535500	13463119	WF OF NB CHICAGO RIVER AT NORTHBROOK IL
05536000	13463123	NORTH BRANCH CHICAGO RIVER AT NILES, IL
05536105	13463903	NB CHICAGO RIVER AT ALBANY AVENUE AT CHICAGO, IL
05536162	13464225	PLUM CREEK NEAR CRETE, IL
05536179	13463881	HART DITCH AT DYER, IN
05536190	13463927	HART DITCH AT MUNSTER, IN
05536195	13463925	LITTLE CALUMET RIVER AT MUNSTER, IN
05536215	13463871	THORN CREEK AT GLENWOOD, IL
05536235	13463863	DEER CREEK NEAR CHICAGO HEIGHTS, IL
05536255	13463861	BUTTERFIELD CREEK AT FLOSSMOOR, IL
05536265	13463865	LANSING DITCH NEAR LANSING, IL
05536275	13463805	THORN CREEK AT THORNTON, IL
05536290	13463917	LITTLE CALUMET RIVER AT SOUTH HOLLAND, IL
05536340	13463785	MIDLOTHIAN CREEK AT OAK FOREST, IL
05536357	13463913	GRAND CALUMET RIVER AT HOHMAN AV AT HAMMOND, IN
05536500	13463761	TINLEY CREEK NEAR PALOS PARK, IL
05536580	13463729	STONY CREEK (WEST) NEAR WORTH, IL
05536890	14786195	CHICAGO SANITARY AND SHIP CANAL NR LEMONT, IL
05537500	14786047	LONG RUN NEAR LEMONT, IL
05537980	14787569	DES PLAINES RIVER AT ROUTE 53 AT JOLIET, IL
05539000	14787409	HICKORY CREEK AT JOLIET, IL
05539900	14786817	WEST BRANCH DU PAGE RIVER NEAR WEST CHICAGO, IL
05540060	14786863	KRESS CREEK AT WEST CHICAGO, IL
05540095	14786925	WEST BRANCH DU PAGE RIVER NEAR WARRENVILLE, IL
05540130	14787003	WEST BRANCH DU PAGE RIVER NEAR NAPERVILLE, IL
05540160	14786891	EAST BRANCH DU PAGE RIVER NEAR DOWNERS GROVE, IL
05540195	14787595	ST. JOSEPH CREEK AT ROUTE 34 AT LISLE, IL
05540250	14787007	EAST BRANCH DU PAGE RIVER AT BOLINGBROOK, IL
05540275	14787017	SPRING BROOK AT 87TH STREET NEAR NAPERVILLE, IL
05540290	14787023	DU PAGE RIVER NEAR PLAINFIELD, IL
05540500	14787279	DU PAGE RIVER AT SHOREWOOD, IL
05541710	14779256	AUX SABLE CREEK NEAR MORRIS, IL
05542000	14780020	MAZON RIVER NEAR COAL CITY, IL
05542500	14780114	ILLINOIS RIVER AT MORRIS, IL
05543500	14780172	ILLINOIS RIVER AT MARSEILLES, IL
05543830	14767570	FOX RIVER AT WAUKESHA, WI
05544200	14768304	MUKWONAGO RIVER AT MUKWONAGO, WI
055451345	14768740	WHITE RIVER AT CENTER STREET AT LAKE GENEVA, WI
05545750	14769576	FOX RIVER NEAR NEW MUNSTER, WI
05548105	14770846	NIPPERSINK CREEK ABOVE WONDER LAKE, IL
05548280	14771284	NIPPERSINK CREEK NEAR SPRING GROVE, IL
05549000	14771320	BOONE CREEK NEAR MC HENRY, IL
05550001	14771760	FOX RIVER (TAILWATER) AT ALGONQUIN, IL
05550300	14771186	TYLER CREEK AT ELGIN, IL
05550500	14771374	POPLAR CREEK AT ELGIN, IL
05551000	14762931	FOX RIVER AT SOUTH ELGIN, IL
05551200	14762045	FERSON CREEK NEAR ST. CHARLES, IL
05551330	14762111	MILL CREEK NEAR BATAVIA, IL
05551540	14762989	FOX RIVER AT MONTGOMERY, IL
05551545	14762345	WAUBONSEE CREEK NEAR OSWEGO, IL
05551580	14763017	FOX RIVER AT YORKVILLE, IL
05551675	14762875	BLACKBERRY CREEK NEAR MONTGOMERY, IL
05552500	14763925	FOX RIVER AT DAYTON, IL
05554300	13619421	INDIAN CREEK NEAR FAIRBURY, IL
05554500	13618713	VERMILION RIVER AT PONTIAC, IL
05555300	13617265	VERMILION RIVER NEAR LEONORE, IL
05556500	14836121	BIG BUREAU CREEK AT PRINCETON, IL
05558300	14837877	ILLINOIS RIVER AT HENRY, IL
05560500	14839241	FARM CREEK AT FARMDALE, IL
05561500	14839053	FONDULAC CREEK NEAR EAST PEORIA, IL
05567500	13597567	MACKINAW RIVER NEAR CONGERVILLE, IL
05568000	13598741	MACKINAW RIVER NEAR GREEN VALLEY, IL
05568500	13606262	ILLINOIS RIVER AT KINGSTON MINES, IL
05568800	13581342	INDIAN CREEK NEAR WYOMING, IL
05569500	13584750	SPOON RIVER AT LONDON MILLS, IL
05570000	13586224	SPOON RIVER AT SEVILLE, IL
05570910	13571661	SANGAMON RIVER AT FISHER, IL
05572000	13571751	SANGAMON RIVER AT MONTICELLO, IL
05573540	13572849	SANGAMON RIVER AT ROUTE 48 AT DECATUR, IL
05576000	13565382	SOUTH FORK SANGAMON RIVER NEAR ROCHESTER, IL
05576250	13564562	SUGAR CREEK NEAR SPRINGFIELD, IL
05576500	14820367	SANGAMON RIVER AT RIVERTON, IL
05577500	14820569	SPRING CREEK AT SPRINGFIELD, IL
05578000	14818845	SANGAMON RIVER AT PETERSBURG, IL
05578100	13552087	SALT CREEK NEAR FARMER CITY, IL
05578250	13552291	NORTH FORK SALT CREEK NEAR DE WITT, IL
05578500	13554729	SALT CREEK NEAR ROWELL, IL
05579500	13555705	LAKE FORK NEAR CORNLAND, IL
05579610	13551289	KICKAPOO CREEK AT 2100E ROAD NEAR BLOOMINGTON, IL
05579620	13551311	KICKAPOO CREEK TRIBUTARY NEAR BLOOMINGTON, IL
05579630	13551309	KICKAPOO CREEK NEAR BLOOMINGTON, IL
05579725	13551669	LITTLE KICKAPOO CREEK NEAR HEYWORTH, IL
05580000	13554633	KICKAPOO CREEK AT WAYNESVILLE, IL
05580950	13552723	SUGAR CREEK NEAR BLOOMINGTON, IL
05582000	13554847	SALT CREEK NEAR GREENVIEW, IL
05583000	14819009	SANGAMON RIVER NEAR OAKFORD, IL
05584500	13802760	LA MOINE RIVER AT COLMAR, IL
05585000	13803642	LA MOINE RIVER AT RIPLEY, IL
05586100	3598326	ILLINOIS RIVER AT VALLEY CITY, IL
05586647	5914509	MACOUPIN CREEK AT HWY 108 NR CARLINVILLE, IL
05586745	5915359	MACOUPIN CREEK AT HWY 111 NR SUMMERVILLE, IL
05587000	5915205	MACOUPIN CREEK NEAR KANE, IL
05587450	880480	Mississippi River at Grafton, IL
05587900	3623245	CAHOKIA CREEK AT EDWARDSVILLE, IL
05588000	3623981	INDIAN CREEK AT WANDA, IL
05590050	13769580	COPPER SLOUGH AT CHAMPAIGN, IL
05590520	13770104	KASKASKIA RIVER BELOW FICKLIN, IL
05590800	13771194	LAKE FORK AT ATWOOD, IL
05590950	13770282	KASKASKIA RIVER AT CHESTERVILLE, IL
05591200	13771264	KASKASKIA RIVER AT COOKS MILLS, IL
05591550	13771102	WHITLEY CREEK NEAR ALLENVILLE, IL
05591700	13770228	WEST OKAW RIVER NEAR LOVINGTON, IL
05592000	13771756	KASKASKIA RIVER AT SHELBYVILLE, IL
05592050	13771802	ROBINSON CREEK NEAR SHELBYVILLE, IL
05592100	13772120	KASKASKIA RIVER NEAR COWDEN, IL
05592500	13871274	KASKASKIA RIVER AT VANDALIA, IL
05592575	13869098	HICKORY CREEK NEAR BROWNSTOWN, IL
05592800	13870316	HURRICANE CREEK NEAR MULBERRY GROVE, IL
05592900	13870642	EAST FORK KASKASKIA RIVER NEAR SANDOVAL, IL
05593000	13871382	KASKASKIA RIVER AT CARLYLE, IL
05593575	13873068	LITTLE CROOKED CREEK NEAR NEW MINDEN, IL
05593900	13881906	EAST FORK SHOAL CREEK NEAR COFFEEN, IL
05593945	13883048	SHOAL CREEK NEAR PIERRON, IL
05594000	13883102	SHOAL CREEK NEAR BREESE, IL
05594100	13890744	KASKASKIA RIVER NEAR VENEDY STATION, IL
05594450	13888668	SILVER CREEK NEAR TROY, IL
05594800	13891008	SILVER CREEK NEAR FREEBURG, IL
05595000	13893016	KASKASKIA RIVER AT NEW ATHENS, IL
05595200	13891354	RICHLAND CREEK NEAR HECKER, IL
05595730	13783124	RAYSE CREEK NEAR WALTONVILLE, IL
05595820	13778814	CASEY FORK AT MOUNT VERNON, IL
05597000	13786604	BIG MUDDY RIVER AT PLUMFIELD, IL
05597500	13784728	CRAB ORCHARD CREEK NEAR MARION, IL
05599490	13786642	BIG MUDDY RIVER AT RTE 127 AT MURPHYSBORO, IL
06006000	4172734	Red Rock Cr ab Lakes, nr Lakeview, MT
06012500	4169038	Red Rock R bl Lima Reservoir nr Monida MT
06016000	4216412	Beaverhead River at Barretts MT
06017000	4215456	Beaverhead River at Dillon MT
06018500	4215022	Beaverhead River near Twin Bridges MT
06019500	240680	Ruby River above reservoir near Alder, MT
06020600	240642	Ruby River below reservoir near Alder, MT
06023000	239166	Ruby River near Twin Bridges MT
06023100	4213042	Beaverhead River at Twin Bridges, MT
06023500	4230526	Big Hole River near Jackson MT
06023800	4230204	Big Hole River ab Spring Creek nr Jackson MT
06024020	4231158	Big Hole River at Miner Creek nr Jackson MT
06024450	4223684	Big Hole River bl Big Lake Cr at Wisdom MT
06024540	4224658	Big Hole River bl Mudd Cr nr Wisdom MT
06024580	4224646	Big Hole River near Wise River MT
06025250	4226632	Big Hole River at Maiden Rock nr Divide MT
06025500	4228286	Big Hole River near Melrose MT
06026210	4231932	Big Hole River near Glen MT
06026420	4228060	Big Hole R bl Hamilton Ditch nr Twin Bridges, MT
06026500	4316948	Jefferson River near Twin Bridges MT
06027600	4315464	Jefferson River at Parsons Bdg nr Silver Star, MT
06033000	4331165	Boulder River near Boulder MT
06035000	4319088	Willow Creek near Harrison MT
06036650	4320140	Jefferson River near Three Forks MT
06036805	3061736	Firehole River at Old Faithful, YNP
06036905	3061602	Firehole River near West Yellowstone MT
06036940	3061578	Tantalus Creek at Norris Junction, YNP
06037100	3060622	Gibbon River at Madison Jct, YNP
06037500	3059764	Madison River near West Yellowstone, MT
06038500	3057956	Madison River bl Hebgen Lake nr Grayling MT
06038800	3059646	Madison River at Kirby Ranch nr Cameron MT
06040000	3056360	Madison River near Cameron MT
06041000	3054074	Madison River bl Ennis Lake nr McAllister MT
06043120	3855837	Gallatin River above Deer Creek, near Big Sky, MT
06043500	3855315	Gallatin River near Gallatin Gateway, MT
06048650	3852267	E Gallatin R ab Water Reclamation Fa nr Bozeman MT
06050000	3853413	Hyalite C at Hyalite R S nr Bozeman MT
06052500	3850885	Gallatin River at Logan MT
06054500	3030030	Missouri River at Toston MT
06061500	3024246	Prickly Pear Creek near Clancy MT
06062500	3021776	Tenmile Creek near Rimini MT
06063000	3021550	Tenmile Creek near Helena MT
06065500	3024846	Missouri River bl Hauser Dam near Helena MT
06066500	3021998	Missouri River bl Holter Dam nr Wolf Cr MT
06071300	3018600	Little Prickly Pear Cr at Wolf Cr MT
06073500	12439987	Dearborn River near Craig MT
06074000	12443973	Missouri River at Cascade MT
06076690	12419295	Smith River near Ft Logan MT
06077200	12419159	Smith River bl Eagle Cr nr Fort Logan MT
06077500	12416463	Smith River near Eden MT
06078200	12443901	Missouri River near Ulm MT
06078500	12395494	North Fork Sun River near Augusta MT
06079000	12395028	South Fork Sun River near Augusta MT
06080900	12395582	Sun River bl Diversion Dam nr Augusta MT
06082200	12395664	Sun River bl Willow Cr nr Augusta MT
06085800	12397906	Sun River at Simms MT
06088500	12397372	Muddy Creek at Vaughn MT
06089000	12397894	Sun River near Vaughn MT
06090300	12435265	Missouri River near Great Falls MT
06090500	12493987	Belt Creek near Monarch MT
06090650	12435001	Lake Creek near Power MT
06090800	12436757	Missouri River at Fort Benton MT
06091700	12538518	Two Medicine River bl South Fork nr Browning MT
06092020	12536216	Two Medicine River ab Badger Cr, nr Piegan, MT
06093200	12538720	Badger Cr bl Four Horns Canal nr Browning MT
06098120	12538692	Birch Creek at Bullhead Bridge, nr Valier, MT
06098800	12656991	Cut Bank Cr ab Gillam Coulee, nr Sundance, MT
06099000	12657047	Cut Bank Creek at Cut Bank MT
06099500	12644287	Marias River near Shelby MT
06101500	12644047	Marias River near Chester MT
06102050	12646291	Marias River near Loma MT
06102500	12744853	Teton River bl South Fork nr Choteau MT
06108000	12745871	Teton River near Dutton MT
06108800	12746007	Teton River at Loma MT
06109500	12735448	Missouri River at Virgelle MT
06110020	12379043	Judith River above Carr Creek near Utica MT
06111800	12377951	Big Spring Cr at R&B Trading Post nr Lewistown MT
06114700	12375905	Judith River nr mouth, nr Winifred MT
06115200	12352441	Missouri River near Landusky MT
06119200	12617818	South Fork Musselshell River at Martinsdale, MT
06119600	12619198	Musselshell River nr Martinsdale, MT
06120500	12619810	Musselshell River at Harlowton MT
06123030	12620110	Musselshell River ab Mud Cr nr Shawmut MT
06125600	12621638	Musselshell River ab Big Coulee Creek at Lavina MT
06126500	12606701	Musselshell River near Roundup MT
06127500	12603855	Musselshell River at Musselshell MT
06130000	12599885	Flatwillow Creek near Mosby MT
06130500	12723432	Musselshell River at Mosby MT
06131200	12355773	Nelson Creek near Van Norman MT
06133500	12345857	N F Milk River ab St. Mary canal nr Browning MT
06135000	12340828	Milk River at Eastern Crossing of Int Bndry
06139500	12319297	Big Sandy Creek near Havre MT
06140500	12323071	Milk River at Havre MT
06142400	12323087	Clear Creek near Chinook MT
06151500	12472144	Battle Creek near Chinook MT
06154100	12327527	Milk River near Harlem MT
06154400	12532944	Peoples Creek near Hays MT
06155030	12327243	Milk River near Dodson MT
06155500	12328223	Milk River at Malta MT
06164510	12306001	Milk River at Juneberg Bridge nr Saco MT
06166000	12297370	Beaver Cr bl Guston Coulee nr Saco MT
06167500	12296610	Beaver Creek near Hinsdale MT
06169500	12289022	Rock Creek bl Horse Creek nr int'l boundary
06172310	12307723	Milk River at Tampico MT
06174500	12308335	Milk River at Nashua MT
06177000	12463734	Missouri River near Wolf Point MT
06177500	12526443	Redwater River at Circle MT
06178000	12515978	Poplar River at international boundary
06181000	12517334	Poplar River near Poplar MT
06183450	3097061	Big Muddy Creek near Antelope MT
06185110	3102237	Big Muddy Creek nr mouth nr Culbertson MT
06185500	3012079	Missouri River near Culbertson MT
06186500	2965742	Yellowstone River at Yellowstone Lk Outlet YNP
06187915	2962790	Soda Butte Cr at Park Bndry at Silver Gate
06188000	2965578	Lamar River nr Tower Ranger Station YNP
06191000	2965566	Gardner River near Mammoth, YNP
06191500	4369760	Yellowstone River at Corwin Springs MT
06192500	4366016	Yellowstone River near Livingston, MT
06192980	4061394	Shields River ab Smith Cr, nr Wilsall, MT
06195600	4064058	Shields River nr Livingston MT
06197800	4365188	East Boulder River bl Dry Fork Cr nr Mcleod, MT
06200000	4366570	Boulder River at Big Timber MT
06204050	7186866	West Rosebud Creek near Roscoe MT
06204070	7186434	W Rosebud Cr at Emerald Lk Campground nr Roscoe
06205000	7184606	Stillwater River near Absarokee, MT
06207500	4265860	Clarks Fork Yellowstone River nr Belfry MT
06208500	4268026	Clarks Fork Yellowstone River at Edgar MT
06209500	4264796	Rock Creek near Red Lodge MT
06211000	4265440	Red Lodge Cr ab Cooney Re nr Boyd MT
06211500	4263450	Willow Creek near Boyd MT
06214500	4342992	Yellowstone River at Billings MT
06216900	12913595	Pryor Creek nr Huntley MT
06218500	12898110	WIND RIVER NEAR DUBOIS, WY
06220800	12900872	WIND RIVER ABOVE RED CREEK, NEAR DUBOIS, WY
06221400	12899984	DINWOODY CREEK ABOVE LAKES, NEAR BURRIS, WY
06224000	12900462	BULL LAKE CREEK ABOVE BULL LAKE, WY
06225000	12900374	Bull Lake Creek near Lenore, WY
06225500	12901126	Wind River near Crowheart, WY
06227600	12902084	WIND RIVER NEAR KINNEAR, WY
06228000	12902364	WIND RIVER AT RIVERTON, WY
06228350	12889559	SF L WIND RIV AB WASHAKIE RES, NR FT WASHAKIE, WY
06233000	12882798	LITTLE POPO AGIE RIVER NEAR LANDER, WY
06235500	12890553	LITTLE WIND RIVER NEAR RIVERTON, WY
06236100	12902120	WIND RIVER AB BOYSEN RESERVOIR, NR SHOSHONI, WY
06253000	12871001	FIVEMILE CREEK NEAR SHOSHONI, WY
06259000	12870023	WIND RIVER BELOW BOYSEN RESERVOIR, WY
