gage	nwm30_link	name
01010000	4289887	St. John River at Ninemile Bridge, Maine
01010070	4289553	Big Black River near Depot Mtn, Maine
01010500	4288603	St. John River at Dickey, Maine
01011000	721640	Allagash River near Allagash, Maine
01011500	4288013	St. Francis River near Connors, New Brunswick
01013500	724696	Fish River near Fort Kent, Maine
01014000	4287759	St. John River below Fish R, nr Fort Kent, Maine
01015800	805443	Aroostook River near Masardis, Maine
01017000	805113	Aroostook River at Washburn, Maine
01017060	802939	Hardwood Brook below Glidden Brk nr Caribou, Maine
01017290	802877	Little Madawaska River at Caribou, Maine
01017550	816569	Williams Brook at Phair, Maine
01017960	817263	Meduxnekeag R above S Br Medux. R nr Houlton, ME
01018000	817261	Meduxnekeag River near Houlton, Maine
01018009	817499	Pearce Brook at Route 1 at Houlton, Maine
01018035	817165	Meduxnekeag River at Lowery Rd. nr Houlton, Maine
01018500	1010003783	St. Croix River at Vanceboro, Maine
01019000	5196478	Grand Lake Stream at Grand Lake Stream, Maine
01021000	5197200	St. Croix River at Baring, Maine
01021470	2677654	Libby Brook near Northfield, Maine
01021480	2676222	Old Stream near Wesley, Maine
01022294	2679458	East Br Bear Brook near Beddington, Maine
01022500	2677104	Narraguagus River at Cherryfield, Maine
01022840	2683216	Otter Creek near Bar Harbor, Maine
01027200	1702734	North Branch Penobscot River nr Pittston Farm, ME
01027240	1702872	S. Br. Penobscot River nr Canada Falls Lake, Maine
01029200	1711010	Seboeis River near Shin Pond, Maine
01029500	1713454	East Branch Penobscot River at Grindstone, Maine
01030350	3109	Wytopitlock Stream near Wytopitlock Maine
01030500	3923	Mattawamkeag River near Mattawamkeag, Maine
01031300	1721977	Piscataquis River at Blanchard, Maine
01031450	1722913	Kingsbury Stream at Abbot Village, Maine
01031500	1722317	Piscataquis River near Dover-Foxcroft, Maine
01031510	1722933	Black Stream near Dover-Foxcroft, Maine
01034000	1720007	Piscataquis River at Medford, Maine
01034500	1733994	Penobscot River at West Enfield, Maine
01037000	1735782	Kenduskeag Stream near Bangor, Maine
01037380	2685414	Ducktrap River near Lincolnville, Maine
01038000	5202858	Sheepscot River at North Whitefield, Maine
01042500	1025264	Kennebec River at The Forks, Maine
01043500	1032541	Dead River near Dead River, Maine
01044550	1032315	Spencer Stream near Grand Falls, Maine
01046000	3318560	Austin Stream at Bingham, Maine
01046500	3319220	Kennebec River at Bingham, Maine
01047000	3321976	Carrabassett River near North Anson, Maine
01047150	3322102	Kennebec River near Madison, Maine
01047200	3323262	Sandy River near Madrid, Maine
01048000	3322258	Sandy River near Mercer, Maine
01048220	3320218	East Branch Wesserunsett Stream near Athens, Maine
01049500	3324780	Cobbosseecontee Stream at Gardiner, Maine
01052500	19334265	Diamond River near Wentworth Location, NH
01053500	19334535	Androscoggin River at Errol, NH
01053600	19334577	Androscoggin River below Bog Brook at Cambridge NH
01054000	19335265	Androscoggin River near Gorham, NH
01054114	19335075	Peabody River at Gorham, New Hampshire
01054200	6716129	Wild River at Gilead, Maine
01054300	6710239	Ellis River at South Andover, Maine
01054500	6710311	Androscoggin River at Rumford, Maine
01055000	6709987	Swift River near Roxbury, Maine
01055500	6712297	Nezinscot River at Turner Center, Maine
01057000	6711893	Little Androscoggin River near South Paris, Maine
01059000	6712623	Androscoggin River near Auburn, Maine
01060000	6722249	Royal River at Yarmouth, Maine
01063310	6720973	Stony Brook at East Sebago, Maine
01064118	6724855	Presumpscot River at Westbrook, Maine
010642505	9311719	SACO RIVER AT RIVER STREET, AT BARTLETT, NH
01064500	9316375	Saco River near Conway, NH
01064801	9315863	BEARCAMP RIVER AT SOUTH TAMWORTH, NH
01066000	9314337	Saco River at Cornish, Maine
01067950	5845376	Kennebunk River near Kennebunk, Maine
01068910	5845396	Mousam River at Route 4 near Sanford, Maine
01069500	5844210	Mousam River near West Kennebunk, Maine
01069700	5844484	Branch Brook near Kennebunk, Maine
01072800	5844728	COCHECO RIVER NEAR ROCHESTER, NH
01072870	5844802	ISINGLASS R AT ROCHESTER NECK RD, NR DOVER, NH
01073000	5845058	OYSTER RIVER NEAR DURHAM, NH
01073319	5848186	LAMPREY RIVER AT LANGFORD ROAD, AT RAYMOND, NH
01073500	5845142	LAMPREY RIVER NEAR NEWMARKET, NH
010735562	5850752	EXETER RIVER AT ODELL ROAD, NEAR SANDOWN, NH
01073587	5850736	EXETER RIVER AT HAIGH ROAD, NEAR BRENTWOOD, NH
01073785	5845268	WINNICUT RIVER AT GREENLAND, NR PORTSMOUTH, NH
01074520	6728911	EAST BRANCH PEMIGEWASSET RIVER AT LINCOLN, NH
01075000	6731257	PEMIGEWASSET RIVER AT WOODSTOCK, NH
01076000	6730287	BAKER RIVER NEAR RUMNEY, NH
01076500	6731463	PEMIGEWASSET RIVER AT PLYMOUTH, NH
01077400	6730525	COCKERMOUTH RIVER BELOW HARDY BROOK, AT GROTON, NH
01078000	6731199	SMITH RIVER NEAR BRISTOL, NH
01081000	6739752	WINNIPESAUKEE RIVER AT TILTON, NH
01081500	6741776	MERRIMACK RIVER AT FRANKLIN JUNCTION, NH
01082000	6764084	CONTOOCOOK RIVER AT PETERBOROUGH, NH
01085000	6761358	CONTOOCOOK RIVER NEAR HENNIKER, NH
01085500	6762034	CONTOOCOOK R BL HOPKINTON DAM AT W HOPKINTON, NH
01086000	6761776	WARNER RIVER AT DAVISVILLE, NH
01089100	6740400	SOUCOOK RIVER, AT PEMBROKE ROAD, NEAR CONCORD, NH
01089500	6740276	SUNCOOK RIVER AT NORTH CHICHESTER, NH
01089925	6741448	SUNCOOK RIVER AT NH 28, NEAR SUNCOOK, NH
01091000	6741162	SOUTH BRANCH PISCATAQUOG RIVER NEAR GOFFSTOWN, NH
01091500	6741094	PISCATAQUOG RIVER NEAR GOFFSTOWN, NH
01092000	6745688	MERRIMACK R NR GOFFS FALLS, BELOW MANCHESTER, NH
01093852	6744326	SOUHEGAN RIVER (SITE WLR-1) NEAR MILFORD, NH
01094000	6745410	SOUHEGAN RIVER AT MERRIMACK, NH
01094400	6075713	NORTH NASHUA RIVER AT FITCHBURG, MA
01094500	6076105	NORTH NASHUA RIVER NEAR LEOMINSTER, MA
01095220	6078267	STILLWATER RIVER NEAR STERLING, MA
01095375	6078329	QUINAPOXET RIVER AT CANADA MILLS NEAR HOLDEN, MA
01095434	6078383	GATES BROOK NEAR WEST BOYLSTON, MA
01095503	931070172	NASHUA RIVER, WATER STREET BRIDGE, AT CLINTON, MA
01096000	6076039	SQUANNACOOK RIVER NEAR WEST GROTON, MA
01096500	6075425	NASHUA RIVER AT EAST PEPPERELL, MA
010965852	6744642	BEAVER BROOK AT NORTH PELHAM, NH
01097000	6772217	ASSABET RIVER AT MAYNARD, MA
01097300	6771169	NASHOBA BROOK NEAR ACTON, MA
01098500	6772477	COCHITUATE BK BL LAKE COCHITUATE AT FRAMINGHAM, MA
01098530	6772927	SUDBURY RIVER AT SAXONVILLE, MA
01099500	6771379	CONCORD R BELOW R MEADOW BROOK, AT LOWELL, MA
01100000	6746184	MERRIMACK RIVER BL CONCORD RIVER AT LOWELL, MA
01100505	6744330	SPICKET RIVER AT NORTH SALEM, NH
01100561	6744772	SPICKET RIVER NEAR METHUEN, MA
01100568	6747190	SHAWSHEEN RIVER AT HANSCOM FIELD NEAR BEDFORD, MA
01100600	6745188	SHAWSHEEN RIVER NEAR WILMINGTON, MA
01100627	6744972	SHAWSHEEN RIVER AT BALMORAL STREET AT ANDOVER, MA
01101000	5860613	PARKER RIVER AT BYFIELD, MA
01101500	5862629	IPSWICH RIVER AT SOUTH MIDDLETON, MA
01102000	5860401	IPSWICH RIVER NEAR IPSWICH, MA
01102345	5867391	SAUGUS RIVER AT SAUGUS IRONWORKS AT SAUGUS, MA
01103025	5866419	ALEWIFE BROOK NEAR ARLINGTON, MA
01103280	5867575	CHARLES RIVER AT MEDWAY, MA
01103455	5867443	TROUT BROOK AT DOVER, MA
01103500	5867435	CHARLES RIVER AT DOVER, MA
01104000	5867457	MOTHER BROOK AT DEDHAM, MA
01104200	5867409	CHARLES RIVER AT WELLESLEY, MA
01104370	5866443	STONY BROOK AT VILES STREET, NEAR WESTON, MA
01104405	5866375	HOBBS BROOK AT MILL ST NR LINCOLN, MA
01104430	5866423	HOBBS BK BELOW CAMBRIDGE RES NR KENDALL GREEN, MA
01104455	5866457	STONY BROOK, UNNAMED TRIBUTARY 1, NEAR WALTHAM, MA
01104475	5866465	STONY BROOK RES., UNNAMED TRIB 1, NEAR WESTON, MA
01104480	5867733	STONY BROOK RESERVOIR AT DAM NEAR WALTHAM, MA
01104500	5868225	CHARLES RIVER AT WALTHAM, MA
01105000	5867537	NEPONSET RIVER AT NORWOOD, MA
01105500	5867561	EAST BRANCH NEPONSET RIVER AT CANTON, MA
011055525	5867477	PONKAPOAG BRK UPSTREAM RT 138,NR CANTON, MA
01105554	5867473	NEPONSET RIVER AT GREENLODGE ST NEAR CANTON, MA
011055566	5866519	NEPONSET RIVER AT MILTON VILLAGE, MA
01105583	5863761	MONATIQUOT RIVER AT EAST BRAINTREE, MA
01105600	5863773	OLD SWAMP RIVER NEAR SOUTH WEYMOUTH, MA
01105608	5863459	WHITMANS POND FISH LADDER AT EAST WEYMOUTH, MA
01105638	5863429	WEIR RIVER AT LEAVITT STREET AT HINGHAM, MA
01105730	5876155	INDIAN HEAD RIVER AT HANOVER, MA
01105870	166174917	JONES RIVER AT KINGSTON, MA
01105876	166174904	EEL RIVER AT RT 3A NEAR PLYMOUTH, MA
01105880	5878893	HERRING RIVER AT NORTH HARWICH, MA
011058837	5878731	QUASHNET RIVER AT WAQUOIT VILLAGE, MA
01105917	5878903	MATTAPOISETT RIVER NEAR MATTAPOISETT, MA
01105933	5878911	PASKAMANSET RIVER NEAR SOUTH DARTMOUTH, MA
01108000	6126439	TAUNTON RIVER NEAR BRIDGEWATER, MA
01108410	6128297	MILL RIVER AT SPRING STREET AT TAUNTON, MA
01109000	6129519	WADING RIVER NEAR NORTON, MA
01109060	6129565	THREEMILE RIVER AT NORTH DIGHTON, MA
01109070	6128635	SEGREGANSET RIVER NEAR DIGHTON, MA
01109403	6128655	TEN MILE R., PAWTUCKET AVE. AT E. PROVIDENCE, RI
01109730	6115840	BLACKSTONE RIVER, W. MAIN ST., AT MILLBURY, MA
01110000	6115740	QUINSIGAMOND RIVER AT NORTH GRAFTON, MA
01110500	6116708	BLACKSTONE RIVER AT NORTHBRIDGE, MA
01111212	6116268	BLACKSTONE RIVER, RT 122 BRIDGE NEAR UXBRIDGE, MA
01111300	6118862	NIPMUC RIVER NEAR HARRISVILLE, RI
01111500	6119204	BRANCH RIVER AT FORESTDALE, RI
01112500	6117292	BLACKSTONE RIVER AT WOONSOCKET, RI
01113895	6128415	BLACKSTONE R AT ROOSEVELT ST AT PAWTUCKET RI
01114000	167237335	MOSHASSUCK RIVER AT PROVIDENCE, RI
01114500	6128489	WOONASQUATUCKET RIVER AT CENTERDALE, RI
01115098	6128495	PEEPTOAD BROOK AT ELMDALE RD NR NORTH SCITUATE, RI
01115110	6128513	HUNTINGHOUSE BK AT ELMDALE RD AT N SCITUATE, RI
01115114	6128591	RUSH BROOK NEAR ELMDALE RD NEAR NORTH SCITUATE, RI
01115170	6128559	MOSWANSICUT STREAM NR NORTH SCITUATE, RI
01115183	6129613	QUONOPAUG BK AT RT 116 NR NORTH SCITUATE, RI
01115187	6128661	PONAGANSET RIVER AT SOUTH FOSTER, RI
01115190	6128659	DOLLY COLE BK AT OLD DANIELSON PK AT S FOSTER, RI
01115265	6128769	HEMLOCK BROOK AT KING ROAD NR FOSTER, RI
01115276	6128797	WESTCONNAUG STREAM AT PLAINFIELD PIKE, RI
01115280	6128763	CORK BK AT ROCKLAND SCITUATE RD NR CLAYVILLE, RI
01115630	6129235	NOOSENECK RIVER AT NOOSENECK, RI
01116000	6129689	SOUTH BRANCH PAWTUXET RIVER AT WASHINGTON, RI
01116500	6129655	PAWTUXET RIVER AT CRANSTON, RI
01116905	6129219	HUNT R 250 FT DS FRY BRK AT FRENCHTOWN, RI
01117000	6129703	HUNT RIVER NEAR EAST GREENWICH, RI
01117350	166174967	CHIPUXET RIVER AT WEST KINGSTON, RI
01117370	6140308	QUEEN R AT LIBERTY RD AT LIBERTY RI
01117420	6141056	USQUEPAUG RIVER NEAR USQUEPAUG, RI
01117430	6141076	PAWCATUCK RIVER AT KENYON, RI
01117468	6140842	BEAVER RIVER NEAR USQUEPAUG, RI
01117500	6141084	PAWCATUCK RIVER AT WOOD RIVER JUNCTION, RI
01117800	6139996	WOOD RIVER NEAR ARCADIA, RI
01118000	6140122	WOOD RIVER AT HOPE VALLEY, RI
01118300	6140826	PENDLETON HILL BROOK NEAR CLARKS FALLS, CT
01118500	6140952	PAWCATUCK RIVER AT WESTERLY, RI
01118700	6168776	WHITFORD BK AT OLD MYSTIC,CT.
01119382	6162555	WILLIMANTIC RIVER AT MERROW RD. NEAR MERROW, CT
01119500	6162965	WILLIMANTIC RIVER NEAR COVENTRY, CT
01120790	6162939	NATCHAUG RIVER AT MARCY RD. NEAR CHAPLIN, CT
01121000	6162583	MOUNT HOPE RIVER NEAR WARRENVILLE, CT
01121330	6162579	FENTON RIVER AT MANSFIELD, CT
01122000	6163159	NATCHAUG RIVER AT WILLIMANTIC, CT
01122500	6163185	SHETUCKET RIVER NEAR WILLIMANTIC, CT
01123000	6162981	LITTLE RIVER NEAR HANOVER, CT
011230695	6163249	SHETUCKET RIVER AT TAFTVILLE, CT
01123360	6147587	QUINEBAUG R BL E BRIMFIELD DAM AT FISKDALE, MA
01123600	6147605	QUINEBAUG R BL WESTVILLE DAM NR SOUTHBRIDGE, MA
01124000	6144833	QUINEBAUG RIVER AT QUINEBAUG, CT
01124151	6148415	QUINEBAUG RIVER AT WEST THOMPSON, CT
01125100	6148379	FRENCH RIVER AT NORTH GROSVENORDALE, CT
01125490	6148469	LITTLE RIVER AT HARRISVILLE, CT
01125500	6148535	QUINEBAUG RIVER AT PUTNAM, CT
01127000	6149075	QUINEBAUG RIVER AT JEWETT CITY, CT
01127500	6168318	YANTIC RIVER AT YANTIC, CT
011277905	166171720	LATIMER BROOK NR I-95N EXIT 75 NR FLANDERS, CT
01129200	4592169	CONNECTICUT R BELOW INDIAN STREAM NR PITTSBURG, NH
01129500	4593223	CONNECTICUT RIVER AT NORTH STRATFORD, NH
01130000	4593015	UPPER AMMONOOSUC RIVER NEAR GROVETON, NH
01131500	4594661	CONNECTICUT RIVER NEAR DALTON, NH
01133000	4570659	EAST BRANCH PASSUMPSIC RIVER NEAR EAST HAVEN, VT
01134500	4570675	MOOSE RIVER AT VICTORY, VT
01135150	4572347	POPE BROOK (SITE W-3) NEAR NORTH DANVILLE, VT
01135300	4572307	SLEEPERS RIVER (SITE W-5) NEAR ST. JOHNSBURY, VT
01135500	4572379	PASSUMPSIC RIVER AT PASSUMPSIC, VT
01137500	4594599	AMMONOOSUC RIVER AT BETHLEHEM JUNCTION, NH
01138500	9326224	CONNECTICUT RIVER AT WELLS RIVER, VT
01139000	4573927	WELLS RIVER AT WELLS RIVER, VT
01139800	4573939	EAST ORANGE BRANCH AT EAST ORANGE, VT
01142500	6083547	AYERS BROOK AT RANDOLPH, VT
01144000	6084505	WHITE RIVER AT WEST HARTFORD, VT
01144500	9327870	CONNECTICUT RIVER AT WEST LEBANON, NH
01150900	6089027	OTTAUQUECHEE RIVER NEAR WEST BRIDGEWATER, VT
01151500	6089035	OTTAUQUECHEE RIVER AT NORTH HARTLAND, VT
01152010	9329414	SUGAR RIVER 0.2 MI BELOW NH 11, AT SUNAPEE, NH
01152500	9329460	SUGAR RIVER AT WEST CLAREMONT, NH
01153000	6090009	BLACK RIVER AT NORTH SPRINGFIELD, VT
01153550	10102348	WILLIAMS RIVER NEAR ROCKINGHAM VT
01154000	10102844	SAXTONS RIVER AT SAXTONS RIVER, VT
01154500	9331548	CONNECTICUT RIVER AT NORTH WALPOLE, NH
01154950	9331072	COLD RIVER AT HIGH STREET, AT ALSTEAD, NH
01155500	10102950	WEST RIVER AT JAMAICA, VT
01157000	6776779	ASHUELOT RIVER NEAR GILSUM, NH
01158000	6777935	ASHUELOT RIVER BELOW SURRY MT DAM, NEAR KEENE, NH
01158110	6778033	ASHUELOT RIVER ABOVE THE BRANCH, AT KEENE, NH
01160350	6778181	ASHUELOT RIVER AT WEST SWANZEY, NH
01161000	6778371	ASHUELOT RIVER AT HINSDALE, NH
01162000	9343737	MILLERS RIVER NEAR WINCHENDON, MA
01162500	9343363	PRIEST BROOK NEAR WINCHENDON, MA
01163200	9343543	OTTER RIVER AT OTTER RIVER, MA
01166500	9343517	MILLERS RIVER AT ERVING, MA
01168250	10295736	COLD RIVER AT FLORIDA, MA
01168500	10294852	DEERFIELD RIVER AT CHARLEMONT, MA
01169000	10294784	NORTH RIVER AT SHATTUCKVILLE, MA
01169900	10295340	SOUTH RIVER NEAR CONWAY, MA
01170000	10295286	DEERFIELD RIVER NEAR WEST DEERFIELD, MA
01170100	10294622	GREEN RIVER NEAR COLRAIN, MA
01170500	6778961	CONNECTICUT RIVER AT MONTAGUE CITY, MA
01171500	6781041	MILL RIVER AT NORTHAMPTON, MA
01172010	7698892	CONNECTICUT R AT I-391 BRIDGE AT HOLYOKE, MA
01172500	7691387	WARE RIVER NEAR BARRE, MA
01173000	7691403	WARE RIVER AT INTAKE WORKS NEAR BARRE, MA
01173500	7690465	WARE RIVER AT GIBBS CROSSING, MA
01174500	7691881	EAST BRANCH SWIFT RIVER NEAR HARDWICK, MA
01174565	7690043	WEST BRANCH SWIFT RIVER NEAR SHUTESBURY, MA
01175500	7691607	SWIFT RIVER AT WEST WARE, MA
01175670	7690413	SEVENMILE RIVER NEAR SPENCER, MA
01176000	7690649	QUABOAG RIVER AT WEST BRIMFIELD, MA
01177000	7692453	CHICOPEE RIVER AT INDIAN ORCHARD, MA
01179500	6097249	WESTFIELD RIVER AT KNIGHTVILLE, MA
01181000	6096297	WEST BRANCH WESTFIELD RIVER AT HUNTINGTON, MA
01183500	6097467	WESTFIELD RIVER NEAR WESTFIELD, MA
01184000	7700898	CONNECTICUT RIVER AT THOMPSONVILLE, CT
01184100	7699976	STONY BROOK NEAR WEST SUFFIELD, CT
01184490	7700014	BROAD BROOK AT BROAD BROOK, CT
01185500	6107147	WEST BRANCH FARMINGTON RIVER NEAR NEW BOSTON, MA
01186000	6111421	WEST BRANCH FARMINGTON RIVER AT RIVERTON, CT
01186500	6111419	STILL RIVER AT ROBERTSVILLE, CT
01187300	6105951	HUBBARD RIVER NEAR WEST HARTLAND, CT
01187800	6109457	NEPAUG R NR NEPAUG, CT.
01188000	6109247	BUNNELL BROOK NEAR BURLINGTON, CT
01188090	6109643	FARMINGTON RIVER AT UNIONVILLE, CT
01189000	6109479	PEQUABUCK R AT FORESTVILLE, CT.
01189995	6109139	FARMINGTON RIVER AT TARIFFVILLE, CT
01191000	7700166	NORTH BRANCH PARK RIVER AT HARTFORD, CT
01192500	7700148	HOCKANUM RIVER NEAR EAST HARTFORD, CT
01192883	7700532	COGINCHAUG RIVER AT MIDDLEFIELD, CT
01193500	7700458	SALMON RIVER NEAR EAST HAMPTON, CT
01194000	7702612	EIGHTMILE RIVER AT NORTH PLAIN, CT
01194500	7702618	EAST BRANCH EIGHTMILE RIVER NEAR NORTH LYME, CT
01195100	6177558	INDIAN RIVER NEAR CLINTON, CT
01195399	6177416	FARM RIVER AT TOTOKET ROAD AT TOTOKET, CT
01195490	6174422	QUINNIPIAC RIVER AT SOUTHINGTON, CT
01196210	6174472	HONEYPOT BROOK AT CREAMERY ROAD AT CHESHIRE, CT
01196500	6177036	QUINNIPIAC RIVER AT WALLINGFORD, CT
01196561	6177058	MUDDY RIVER NEAR EAST WALLINGFORD, CT
01196620	6177114	MILL RIVER NEAR HAMDEN, CT
01197000	7709630	EAST BRANCH HOUSATONIC RIVER AT COLTSVILLE, MA
01197500	7710210	HOUSATONIC RIVER NEAR GREAT BARRINGTON, MA
01198000	7709954	GREEN RIVER NEAR GREAT BARRINGTON, MA
01198125	7710044	HOUSATONIC RIVER NEAR ASHLEY FALLS, MA
01199000	7711932	HOUSATONIC RIVER AT FALLS VILLAGE, CT
01199050	7711950	SALMON CREEK AT LIME ROCK, CT
01200000	7712756	TENMILE RIVER NEAR GAYLORDSVILLE, CT
01200500	7713698	HOUSATONIC RIVER AT GAYLORDSVILLE, CT
01201487	7716694	STILL RIVER AT ROUTE 7 AT BROOKFIELD CENTER, CT
01202501	7713634	SHEPAUG RIVER AT PETERS DAM AT WOODVILLE, CT
012035055	7717056	POOTATUCK RIVER AT BERKSHIRE
01203510	7716956	POOTATUCK RIVER AT SANDY HOOK, CT
01203600	7713080	NONEWAUG RIVER AT MINORTOWN, CT
01203805	7713138	WEEKEEPEEMEE RIVER AT HOTCHKISSVILLE, CT
01204000	7716608	POMPERAUG RIVER AT SOUTHBURY, CT
01205500	7718288	HOUSATONIC RIVER AT STEVENSON, CT
01206900	7712706	NAUGATUCK RIVER AT THOMASTON, CT
01208171	7713176	NAUGATUCK RIVER AT WATERBURY, CT
01208500	7718060	NAUGATUCK RIVER AT BEACON FALLS, CT
01208873	7733285	ROOSTER RIVER AT FAIRFIELD, CT
01208925	7732355	MILL RIVER NEAR FAIRFIELD, CT
01208950	7733309	SASCO BROOK NEAR SOUTHPORT, CT
01208990	7731677	SAUGATUCK RIVER NEAR REDDING, CT
01209005	7731877	SAUGATUCK R BELOW SAUGATUCK RES NR LYONS PLAIN, CT
01209105	7733259	ASPETUCK RIVER AT ASPETUCK, CT
01209500	7732315	SAUGATUCK RIVER NEAR WESTPORT, CT
012095493	7731717	RIDGEFIELD BROOK AT SHIELDS LANE NR RIDGEFIELD, CT
01209700	7732387	NORWALK RIVER AT SOUTH WILTON, CT
01209761	7732311	FIVEMILE RIVER NEAR NEW CANAAN, CT
01209901	7733045	RIPPOWAM RIVER AT STAMFORD, CT.
01212500	7733091	BYRAM RIVER AT PEMBERWICK, CT
01302020	6241423	BRONX RIVER AT NY BOTANICAL GARDEN AT BRONX NY
01303000	9509792	MILL NECK CREEK AT MILL NECK NY
01303500	9509194	COLD SPRING BROOK AT COLD SPRING HARBOR NY
01304000	9509670	NISSEQUOGUE RIVER NEAR SMITHTOWN NY
01304500	9496622	PECONIC RIVER AT RIVERHEAD NY
01305000	9496458	CARMANS RIVER AT YAPHANK NY
01305500	9496468	SWAN RIVER AT EAST PATCHOGUE NY
01306460	9499614	CONNETQUOT BK NR CENTRAL ISLIP NY
01308000	9499680	SAMPAWAMS CREEK AT BABYLON NY
01308500	9499682	CARLLS RIVER AT BABYLON NY
01309500	9499694	MASSAPEQUA CREEK AT MASSAPEQUA NY
01309950	9499700	BELLMORE CREEK NEAR BELLMORE NY
01310500	9499702	EAST MEADOW BROOK AT FREEPORT NY
01311500	9499706	VALLEY STREAM AT VALLEY STREAM NY
01312000	22305461	HUDSON RIVER NEAR NEWCOMB NY
01315000	22306657	INDIAN RIVER NEAR INDIAN LAKE NY
01315170	22304159	DURGIN BROOK AT BOREAS RIVER NY
01315500	22304861	HUDSON RIVER AT NORTH CREEK NY
01318500	22307227	HUDSON RIVER AT HADLEY NY
01321000	22297114	SACANDAGA RIVER NEAR HOPE NY
01325000	22294854	SACANDAGA RIVER AT STEWARTS BRIDGE NR HADLEY NY
01327500	22287891	GLENS FALLS FEEDER AT DUNHAM BASIN NY
01327750	932020139	HUDSON RIVER AT FORT EDWARD NY
01328770	22288449	HUDSON RIVER AT THOMSON NY
01329490	22288025	BATTEN KILL BELOW MILL AT BATTENVILLE NY
01330000	22288127	GLOWEGEE CREEK AT WEST MILTON NY
01331500	22290241	HOOSIC RIVER AT ADAMS, MA
01332500	22290185	HOOSIC RIVER NEAR WILLIAMSTOWN, MA
01333000	22290373	GREEN RIVER AT WILLIAMSTOWN, MA
01334000	22289963	WALLOOMSAC RIVER NEAR NORTH BENNINGTON, VT
01334500	22290307	HOOSIC RIVER NEAR EAGLE BRIDGE NY
01335754	22290557	HUDSON RIVER ABOVE LOCK 1 NEAR WATERFORD NY
01336000	22743619	MOHAWK RIVER BELOW DELTA DAM NEAR ROME NY
01338000	22742959	ORISKANY CREEK NEAR ORISKANY NY
01339060	22743091	SAUQUOIT CREEK AT WHITESBORO NY
01342602	22743145	MOHAWK RIVER NEAR UTICA NY
01342682	22743357	MOYER CREEK NEAR FRANKFORT NY
01342730	22743475	STEELE CREEK AT ILION NY
01342743	22744699	FULMER CREEK NEAR MOHAWK NY
01343060	22741265	WEST CANADA CREEK NEAR WILMURT NY
01343403	22739849	BLACK CREEK NEAR GRAY NY
01346000	22741581	WEST CANADA CREEK AT KAST BRIDGE NY
01347000	22741627	MOHAWK RIVER NEAR LITTLE FALLS NY
01348000	22741637	EAST CANADA CREEK AT EAST CREEK NY
01349000	22745083	OTSQUAGO CREEK AT FORT PLAIN NY
01349150	22745373	CANAJOHARIE CREEK NEAR CANAJOHARIE NY
01349527	22745907	MOHAWK R ABOVE STATE HIGHWAY 30A AT FONDA NY
01349700	3247570	EAST KILL NEAR JEWETT CENTER NY
01349705	3247486	SCHOHARIE CREEK NEAR LEXINGTON NY
01349711	3247574	WEST KILL BELOW HUNTER BROOK NEAR SPRUCETON NY
01349950	3247582	BATAVIA KILL AT RED FALLS NEAR PRATTSVILLE NY
01350000	3247466	SCHOHARIE CREEK AT PRATTSVILLE NY
01350035	3247556	BEAR KILL NEAR PRATTSVILLE NY
01350080	3247464	MANOR KILL AT WEST CONESVILLE NEAR GILBOA NY
01350101	3247458	SCHOHARIE CREEK AT GILBOA NY
01350120	3247452	PLATTER KILL AT GILBOA NY
01350140	3247552	MINE KILL NEAR NORTH BLENHEIM NY
01350180	3247438	SCHOHARIE CREEK AT NORTH BLENHEIM NY
01350212	3247432	SCHOHARIE CREEK NEAR NORTH BLENHEIM NY
01350355	3246744	SCHOHARIE CREEK AT BREAKABEEN NY
01350480	3246526	LITTLE SCHOHARIE CREEK NEAR MIDDLEBURGH NY
01350500	3246450	SCHOHARIE CREEK AT MIDDLEBURGH NY
01351200	3246094	FOX CREEK NEAR SCHOHARIE NY
01351298	3246106	COBLESKILL CREEK AT S GRAND ST AT COBLESKILL NY
01351500	3247040	SCHOHARIE CREEK AT BURTONSVILLE NY
01354083	22745845	MOHAWK RIVER AT AMSTERDAM NY
01354500	22744303	MOHAWK RIVER AT FREEMAN'S BRIDGE AT SCHENECTADY NY
01357500	22751957	MOHAWK RIVER AT COHOES NY
01358000	6186146	HUDSON RIVER AT GREEN ISLAND NY
01359528	6186102	NORMANS KILL AT ALBANY NY
01360640	6186112	VALATIE KILL NEAR NASSAU NY
01361000	6188948	KINDERHOOK CREEK AT ROSSMAN NY
0136219503	6189668	ESOPUS CREEK BELOW LOST CLOVE RD AT BIG INDIAN NY
013621955	6189634	BIRCH CREEK AT BIG INDIAN NY
01362200	6189624	ESOPUS CREEK AT ALLABEN NY
01362230	6189632	DIVERSION FROM SCHOHARIE RESERVOIR NY
0136230002	6189648	WOODLAND CREEK ABOVE MOUTH AT PHOENICIA NY
01362322	6189746	MYRTLE BROOK AT STATE HWY 214 AT EDGEWOOD NY
01362357	6189748	WARNER CREEK NEAR CHICHESTER NY
01362370	6189644	STONY CLOVE CREEK BLW OX CLOVE AT CHICHESTER NY
01362487	6189750	BEAVER KILL AT MOUNT TREMPER NY
01362497	6189752	LITTLE BEAVER KILL AT BEECHFORD NEAR MT TREMPER NY
01362500	6189754	ESOPUS CREEK AT COLDBROOK NY
01363382	6191718	BUSH KILL BLW MALTBY HOLLOW BK AT WEST SHOKAN NY
01363556	6191738	ESOPUS CREEK NEAR LOMONTVILLE NY
01364500	6193936	ESOPUS CREEK AT MOUNT MARION NY
01365000	6200212	RONDOUT CREEK NEAR LOWES CORNERS NY
01365500	6199814	CHESTNUT CREEK AT GRAHAMSVILLE NY
01367500	6206824	RONDOUT CREEK AT ROSENDALE NY
01367715	6206816	Wallkill R at Scott Road at Franklin NJ
01367805	6203090	Papakating Creek at Roys NJ
01368050	6202798	WALLKILL RIVER AT OIL CITY ROAD NEAR UNIONVILLE NY
01370520	25085434	WALLKILL RIVER AT PHILLIPSBURG NY
01371500	6200432	WALLKILL RIVER AT GARDINER NY
01372500	6212050	WAPPINGER CREEK NEAR WAPPINGERS FALLS NY
0137449480	6227048	EAST BRANCH CROTON RIVER NEAR PUTNAM LAKE NY
01374505	6227134	EAST BRANCH CROTON RIVER AT BREWSTER NY
01374531	6227208	EAST BRANCH CROTON RIVER NEAR CROTON FALLS NY
01374559	6226948	WEST BRANCH CROTON RIVER AT RICHARDSVILLE NY
01374581	6227008	W BR CROTON RIVER BELOW DAM NEAR KENT CLIFFS NY
01374598	6226964	HORSE POUND BROOK NEAR LAKE CARMEL NY
0137462010	6227150	WEST BRANCH CROTON RIVER NEAR CARMEL NY
01374701	6227290	WEST BRANCH CROTON RIVER NEAR CROTON FALLS NY
01374781	6227370	TITICUS RIVER BELOW JUNE ROAD AT SALEM CENTER NY
01374821	6227386	TITICUS RIVER AT PURDYS STATION NY
01374890	6227656	CROSS RIVER NEAR CROSS RIVER NY
01374901	6228280	CROSS RIVER AT KATONAH NY
01374930	6227362	MUSCOOT RIVER AT BALDWIN PLACE NY
01374941	6227578	MUSCOOT RIVER BELOW DAM AT AMAWALK NY
01375000	6227896	CROTON R AT NEW CROTON DAM NR CROTON-ON-HUDSON NY
01376800	6244334	HACKENSACK RIVER AT WEST NYACK NY
01377000	6248392	Hackensack River at Rivervale NJ
01377370	6246640	Pascack Brook at Park Ridge NJ
01377500	6249408	Pascack Brook at Westwood NJ
01378500	6250624	Hackensack River at New Milford NJ
01379000	6250860	Passaic River near Millington NJ
01379500	6250836	Passaic River near Chatham NJ
01379530	6250812	Canoe Brook near Summit NJ
01379773	6249510	Green Pond Brook at Picatinny Arsenal NJ
01379780	6249604	Green Pond Bk blw Picatinny Lk at Picatinny Ars NJ
01380450	6250646	Rockaway River at Main Street at Boonton NJ
01381000	6249860	Rockaway River below Reservoir at Boonton NJ
01381400	6250096	Whippany River near Morristown NJ
01381500	6250748	Whippany River at Morristown NJ
01381800	6249998	Whippany River near Pine Brook NJ
01381900	6250690	Passaic River at Pine Brook NJ
01382210	6246352	Pequannock River at Oak Ridge NJ
01382385	6246084	Pequannock River at Green Pond Junction NJ
01382500	6246362	Pequannock River at Macopin Intake Dam NJ
01382800	6249402	Pequannock River at Riverdale NJ
01383500	6246368	Wanaque River at Awosting NJ
01384500	6245518	Ringwood Creek near Wanaque NJ
01386000	6246332	West Brook near Wanaque NJ
01387000	932030153	Wanaque River at Wanaque NJ
01387095	6245212	RAMAPO R AT MARY H HARRIMAN MEM PK AT HARRIMAN NY
01387400	6245458	RAMAPO RIVER AT RAMAPO NY
01387420	6245602	RAMAPO RIVER AT SUFFERN NY
01387450	6245480	Mahwah River near Suffern NY
01387500	6246322	Ramapo River near Mahwah NJ
01387905	6246098	Ramapo River at West Oakland Avenue at Oakland NJ
01388000	6250614	Ramapo River at Pompton Lakes NJ
01388500	6249470	Pompton River at Pompton Plains NJ
01389010	6251122	Passaic River at I-80 at Singac NJ
01389500	6250676	Passaic River at Little Falls NJ
01389550	6249966	Peckman River at Little Falls NJ
01389890	6251098	Passaic River at Dundee Dam at Clifton NJ
01390450	6245850	Saddle River at Upper Saddle River NJ
01390500	6250616	Saddle River at Ridgewood NJ
01391000	6250612	Hohokus Brook at Ho-Ho-Kus NJ
01391102	6249688	Saddle River below Hohokus Brook at Paramus NJ
