02336840	3285576	SWEETWATER CREEK,BROWNSVILLE RD,POWDER SPRINGS,GA
02336870	3285566	POWDER SPRINGS CREEK NEAR POWDER SPRINGS, GA
02336910	3285574	SWEETWATER CR 0.05 MI US RR BRIDGE AT AUSTELL, GA
02336968	3285562	NOSES CREEK AT POWDER SPRINGS RD,POWDER SPRINGS,GA
02336986	3285556	OLLEY CREEK AT CLAY ROAD, NEAR AUSTELL, GA
02337000	3286256	SWEETWATER CREEK NEAR AUSTELL, GA
02337040	3285802	SWEETWATER CREEK BELOW AUSTELL, GA
02337170	3286494	CHATTAHOOCHEE RIVER NEAR FAIRBURN, GA
02337410	3285980	DOG RIVER AT GA 5, NEAR FAIRPLAY, GA
02337498	3286312	SNAKE CRK DS SNAKE CRK RESERVIOR NR WHITESBURG, GA
02338000	3290264	CHATTAHOOCHEE RIVER NEAR WHITESBURG, GA
02338500	3291986	CHATTAHOOCHEE RIVER AT GA 100, AT FRANKLIN, GA
02338523	3291248	HILLABAHATCHEE CREEK AT THAXTON RD, NR FRANKLIN,GA
02338660	3289348	NEW RIVER AT GA 100, NEAR CORINTH, GA
02338840	3289600	YELLOWJACKET CREEK-HAMMETT RD, BLW HOGANSVILLE, GA
02339495	3296804	OSELIGEE CREEK NEAR LANETT AL
02339500	3298592	CHATTAHOOCHEE RIVER AT WEST POINT, GA
02341460	3434274	CHATTAHOOCHEE RIVER AT 14TH ST, AT COLUMBUS, GA
02341800	3432234	UPATOI CREEK NEAR COLUMBUS, GA
02342500	3435970	UCHEE CREEK NEAR FORT MITCHELL, AL.
02342850	3433426	HANNAHATCHEE CREEK AT UNION ROAD, AT UNION, GA
02342881	3438596	CHATTAHOOCHEE RIVER AT SPUR 39, NEAR OMAHA, GA
02343225	3440880	PATAULA CREEK NEAR GEORGETOWN, GA
023432415	2306737	CHATTAHOOCHEE R .36 MI DS WFG DAM NR FT GAINES, GA
02343940	2310009	SAWHATCHEE CREEK AT CEDAR SPRINGS, GA
02344280	6411850	CAMP CREEK AT HELMER ROAD, NEAR FAYETTEVILLE, GA
02344327	6411782	MORNING CRK AT WESTBRIDGE RD, NR FAYETTEVILLE, GA
02344350	6415468	FLINT RIVER NEAR LOVEJOY, GA
02344396	6415518	FLINT RIVER AT WOOLSEY ROAD, NEAR WOOLSEY, GA
02344424	6413630	LAKE HORTON TAILRACE NEAR FAYETTEVILLE, GA
02344478	6413892	SHOAL CREEK AT SHOAL CREEK ROAD, NEAR GRIFFIN, GA
02344500	6415592	FLINT RIVER NEAR GRIFFIN, GA
02344605	6415488	LINE CREEK BELOW GA 54, NEAR PEACHTREE CITY, GA
02344620	6413164	SHOAL CREEK AT GA54, NEAR SHARPSBURG, GA
02344630	6415508	LINE CREEK BLW LAKE MCINTOSH, NR PEACHTREE CITY,GA
02344655	6413022	FLAT CR DS OF LAKE KEDRON, NR PEACHTREE CITY, GA
02344673	6415484	FLAT CREEK DS OF LAKE AT PEACHTREE CITY, GA
02344700	6415544	LINE CREEK NEAR SENOIA, GA
02344724	6412650	WHITEWATER CREEK AT EASTIN RD, NR FAYETTEVILLE, GA
02344748	6415536	WHITEWATER CR DS STARRS MILL DAM FAYETTEVILLE,GA
02344872	6415040	FLINT RIVER BELOW BIG BRANCH, NEAR MOLENA, GA
02346310	6415628	POTATO CREEK AT COUNTY LINE RD, NR ORCHARD HILL,GA
02347500	6429916	FLINT RIVER AT US 19, NEAR CARSONVILLE, GA
02349605	6444276	FLINT RIVER AT GA 26, NEAR MONTEZUMA, GA
02349900	6442680	TURKEY CREEK AT BYROMVILLE, GA
02350512	6447636	FLINT RIVER AT GA 32, NEAR OAKFIELD, GA
02350600	6458195	KINCHAFOONEE CREEK AT PRESTON, GA
02350900	6460293	KINCHAFOONEE CREEK AT PINEWOOD ROAD, NR DAWSON, GA
02351500	6457483	MUCKALEE CREEK NEAR AMERICUS, GA
02351890	6460241	MUCKALEE CREEK AT GA 195, NEAR LEESBURG, GA
02352500	933130036	FLINT RIVER AT ALBANY, GA
02353000	3424530	FLINT RIVER AT NEWTON, GA
02353265	25727371	ICHAWAYNOCHAWAY CREEK AT GA 37, NEAR MORGAN, GA
02353400	6470130	PACHITLA CREEK NEAR EDISON, GA
02353500	6471976	ICHAWAYNOCHAWAY CREEK AT MILFORD, GA
02354350	25727251	CHICKASAWHATCHEE CREEK NEAR ALBANY, GA
02354475	6471708	SPRING CREEK NEAR LEARY, GA
02354500	6471974	CHICKASAWHATCHEE CREEK AT ELMODEL, GA
02354800	6471984	ICHAWAYNOCHAWAY CREEK NEAR ELMODEL, GA
02355350	6471862	ICHAWAYNOCHAWAY CREEK BELOW NEWTON, GA
02355662	3424532	FLINT RIVER AT RIVERVIEW PLANTATION, NR HOPEFUL,GA
02356000	3425836	FLINT RIVER AT BAINBRIDGE, GA
02357000	3516630	SPRING CREEK NEAR IRON CITY, GA
02358000	2293124	APALACHICOLA RIVER AT CHATTAHOOCHEE FLA
02358700	2297254	APALACHICOLA RIVER NR BLOUNTSTOWN,FLORIDA
02358789	2134102	CHIPOLA RIVER AT MARIANNA FL
02359000	2133672	CHIPOLA RIVER NR ALTHA, FLA.
02359170	2298964	APALACHICOLA RIVER NR SUMATRA,FLA.
02359500	2178951	ECONFINA CREEK NEAR BENNETT, FLA.
02361000	2188031	CHOCTAWHATCHEE RIVER NEAR NEWTON, AL.
02361500	2189757	CHOCTAWHATCHEE RIVER NEAR BELLWOOD AL
02362240	2188549	LITTLE DOUBLE BRIDGES CREEK NR ENTERPRISE, AL.
02363000	2210130	PEA RIVER NEAR ARITON AL
02364500	2214110	PEA RIVER NEAR SAMSON AL
02365200	2242015	CHOCTAWHATCHEE RIVER NR PITTMAN, FLA.
02365470	2240423	WRIGHTS CREEK AT SH 177-A NR BONIFAY,FL
02365500	2242113	CHOCTAWHATCHEE RIVER AT CARYVILLE, FLA.
02365769	2241851	BRUCE CREEK AT SH 81 NR REDBAY, FL
02366000	2241831	HOLMES CREEK AT VERNON, FLA.
02366500	2244465	CHOCTAWHATCHEE RIVER NR BRUCE, FLA.
02366650	2244409	PINE LOG CREEK NR EBRO, FL
02366996	476177	ALAQUA CREEK NEAR PLEASANT RIDGE, FL
02367310	476941	JUNIPER CREEK AT STATE HWY 85 NR NICEVILLE, FLA.
02367900	896197	YELLOW RIVER NR OAK GROVE, FLA.
02368000	897115	YELLOW RIVER AT MILLIGAN, FLA.
02368500	896891	SHOAL RIVER NR MOSSY HEAD, FLA.
02369000	26823380	SHOAL RIVER NR CRESTVIEW, FLA.
02369600	897999	YELLOW RIVER NR MILTON, FLA.
02369800	789206	BLACKWATER RIVER NEAR BRADLEY AL
02370000	791526	BLACKWATER RIVER NR BAKER, FLA.
02370500	792126	BIG COLDWATER CREEK NR MILTON, FLA.
02371500	2377281	CONECUH RIVER AT BRANTLEY AL
02372250	2323396	PATSALIGA CREEK NEAR BRANTLEY AL
02372422	2378929	CONECUH RIVER BEL PT A DAM NR RIVER FALLS, AL.
02372430	2378189	CONECUH RIVER AT RIVER FALLS, ALABAMA
02373000	2402121	SEPULGA RIVER NEAR MCKENZIE AL
02374050	2410506	FOLLEY CREEK NEAR DIXIE, AL
02374250	2413994	CONECUH RIVER AT STATE HWY 41 NEAR BREWTON, AL.
02374500	933140017	MURDER CREEK NEAR EVERGREEN AL
02374700	2413350	MURDER CREEK AT STATE HWY 41 AT BREWTON, AL.
02374745	2413254	BURNT CORN CREEK AT STATE HWY 41 NEAR BREWTON, AL.
02374950	445834	BIG ESCAMBIA CR AT SARDINE BR NR STANLEY CROSSROAD
02375000	446386	BIG ESCAMBIA CREEK AT FLOMATON AL
02375500	448444	ESCAMBIA RIVER NEAR CENTURY, FL
02376100	10854185	BAYOU MARCUS CREEK NR PENSACOLA,FLA
02376115	10853975	ELEVENMILE CREEK NR WEST PENSACOLA, FL
02376293	2171877	BRUSHY CREEK NEAR BRATT, FL
02376500	2172289	PERDIDO RIVER AT BARRINEAU PARK, FL
02377570	2171465	STYX RIVER NEAR ELSANOR, AL.
02378170	10854075	WOLF CREEK BELOW FOLEY, ALA
02378300	18516128	MAGNOLIA RIVER AT US 98 NEAR FOLEY, ALABAMA
02378500	18514402	FISH RIVER NEAR SILVER HILL AL
02379500	6478057	CARTECAY RIVER NEAR ELLIJAY, GA
02380500	6479383	COOSAWATTEE RIVER NEAR ELLIJAY, GA
02381090	6477993	MOUNTAINTOWN CREEK AT GA 282, NEAR ELLIJAY, GA
02381600	6478765	FAUSETT CREEK NEAR TALKING ROCK, GA
02382200	6479445	TALKING ROCK CREEK NEAR HINTON, GA
02382500	6478587	COOSAWATTEE RIVER AT CARTERS, GA
02383500	6478921	COOSAWATTEE RIVER NEAR PINE CHAPEL, GA
02384500	12193538	CONASAUGA RIVER AT GA 286, NEAR ETON, GA
02384540	12193270	MILL CREEK NEAR CRANDALL, GA
02385170	12193830	COAHULLA CREEK AT KEITHS MILL ROAD, NEAR DALTON,GA
02385500	12193674	MILL CREEK AT DALTON, GA
02385800	12193956	HOLLY CREEK NEAR CHATSWORTH, GA
02387000	12194190	CONASAUGA RIVER AT TILTON, GA
02387500	6486392	OOSTANAULA RIVER AT RESACA, GA
02387600	6487858	OOTHKALOOGA CREEK AT GA 53 SPUR, AT CALHOUN, GA
02388320	6489304	HEATH CREEK NEAR ARMUCHEE, GA
02388350	6489404	ARMUCHEE CREEK AT OLD DALTON ROAD, NEAR ROME, GA
02388500	6489904	OOSTANAULA RIVER NEAR ROME, GA
02388975	6495832	ETOWAH RIVER AT GA 136, NEAR LANDDRUM, GA
02389150	6496178	ETOWAH RIVER AT GA 9, NEAR DAWSONVILLE, GA
02390000	6495864	AMICALOLA CREEK NEAR DAWSONVILLE, GA.
02390050	6496222	ETOWAH RIVER AT KELLY BRIDGE ROAD, NEAR MATT, GA
02390140	6496726	SETTINGDOWN CREEK NEAR BALL GROUND, GA
02391540	6496580	SHARP MTN CREEK AT OLD GA 5, BELOW BALL GROUND, GA
02391840	6497138	HICKORY LOG CREEK NEAR CANTON, GA
02391860	6498588	ETOWAH RIVER DOWNSTREAM OF I-575, AT CANTON, GA
02392000	6498632	ETOWAH RIVER AT CANTON, GA
02392360	6497104	SHOAL CREEK AT GA 108, NEAR WALESKA, GA
02392780	6497814	LITTLE RIVER AT GA 5, NEAR WOODSTOCK, GA
02392920	6498280	NOONDAY CR US CHASTAIN MEADOWS PKWY, MARIETTA, GA
02392950	6498178	NOONDAY CREEK AT HAWKINS STORE RD, NR WOODSTOCK,GA
02392975	6498060	NOONDAY CREEK AT SHALLOWFORD ROAD, NR WOODSTOCK,GA
02393377	6498376	BUTLER CREEK AT MACK DOBBS ROAD, NR KENNESAW, GA
02393419	6500642	ALLATOONA CREEK AT STILESBORO RD, NEAR ACWORTH, GA
02394000	6499252	ETOWAH RIVER AT ALLATOONA DAM, ABV CARTERSVILLE,GA
02394670	6499076	ETOWAH RIVER AT GA 61, NEAR CARTERSVILLE, GA
02394682	6498058	RICHLAND CREEK AT OLD DALLAS RD, NEAR DALLAS, GA
02394820	6501484	EUHARLEE CREEK AT US 278, AT ROCKMART, GA
02395000	6498944	ETOWAH RIVER NEAR KINGSTON,GA
02395120	6498620	TWO RUN CREEK NEAR KINGSTON, GA
02395980	6505962	ETOWAH RIVER AT GA 1 LOOP, NEAR ROME, GA
02397000	15823339	COOSA RIVER MAYO'S BAR NEAR ROME, GA
02397410	15824181	CEDAR CREEK AT GA AVE, AT CEDARTOWN, GA
02397500	15823139	CEDAR CREEK NEAR CEDARTOWN, GA
02397530	15823427	COOSA RIVER AT STATE LINE, AL/GA
02398000	15822875	CHATTOOGA RIVER AT SUMMERVILLE, GA
02398300	15822925	CHATTOOGA RIVER ABOVE GAYLESVILLE AL
02399200	15822929	LITTLE RIVER NEAR BLUE POND AL
02400100	15823141	TERRAPIN CREEK AT ELLISVILLE AL
02400680	22198487	BIG WILLS CREEK AT STATE HWY 35 NR FORT PAYNE, AL
02401000	22200595	BIG WILLS CREEK NEAR REECE CITY
02401390	22203349	BIG CANOE CREEK AT ASHVILLE AL
02401895	22201495	OHATCHEE CREEK AT OHATCHEE, AL
02403310	22201973	CHOCCOLOCCO CREEK NEAR BOILING SPRING, ALABAMA
02404400	22204871	CHOCCOLOCCO CREEK AT JACKSON SHOAL NR LINCOLN AL
02405500	22206103	KELLY CREEK NEAR VINCENT AL
02406500	22206629	TALLADEGA CREEK AT ALPINE AL
02406930	22271988	SHIRTEE CREEK NEAR ODENA, ALABAMA
02407000	22273668	COOSA RIVER AT CHILDERSBURG AL
02407514	22271288	YELLOWLEAF CREEK NEAR WESTOVER, AL
02408150	22274808	WALNUT CREEK ABOVE CLANTON, ALA
02408540	22274612	HATCHET CREEK BELOW ROCKFORD AL
02411590	22276662	COOSA RIVER AT HWY 14 NEAR WETUMPKA, AL
02411930	15810649	TALLAPOOSA RIVER AT US 78, NEAR TALLAPOOSA, GA
02412000	15810691	TALLAPOOSA RIVER NEAR HEFLIN, AL
02413000	15809979	LITTLE TALLAPOOSA RIVER AT US 27, AT CARROLLTON,GA
02413210	15811451	LITTLE TALLAPOOSA R AT GA 100, NEAR BOWDON, GA
02413300	15811667	LITTLE TALLAPOOSA RIVER NEAR NEWELL AL
02414300	22035629	TALLAPOOSA RIVER AT MALONE, ALABAMA
02414500	22042575	TALLAPOOSA RIVER AT WADLEY AL
02414715	22038591	TALLAPOOSA RIVER NR NEW SITE, AL.(HORSESHOE BEND)
02415000	22035157	HILLABEE CREEK NEAR HACKNEYVILLE AL
02418230	21712124	SOUGAHATCHEE CREEK AT CO RD 188 NR LOACHAPOKA, AL.
02418760	21712732	CHEWACLA CREEK AT CHEWACLA STATE PARK NR AUBURN
02419000	21717690	UPHAPEE CREEK NEAR TUSKEGEE AL
02419670	21715322	CUBAHATCHEE CREEK AT US 80 NEAR SHORTER, AL
02419890	21719268	TALLAPOOSA RIVER NEAR MONT.-MONT. WATER WORKS
02421000	21682252	CATOMA CREEK NEAR MONTGOMERY AL
02422500	21676818	MULBERRY CREEK AT JONES AL
02423110	21654088	CAHABA RIVER NEAR TRUSSVILLE, ALA
02423130	21654166	CAHABA RIVER AT TRUSSVILLE, AL.
02423160	21654200	CAHABA RIVER NEAR WHITES CHAPEL AL
02423380	21655350	CAHABA RIVER NEAR MOUNTAIN BROOK AL
02423397	21654312	LITTLE CAHABA RIVER BELOW LEEDS, AL.
02423400	21655328	LITTLE CAHABA RIVER NR JEFFERSON PARK, AL.
02423414	21655412	LITTLE CAHABA RIVER AT CAH BEA RD NR CAHABA HTS AL
02423425	21655464	CAHABA RIVER NEAR CAHABA HEIGHTS AL
02423496	21655568	CAHABA RIVER NEAR HOOVER, AL
02423500	21656498	CAHABA RIVER NEAR ACTON AL
0242354750	21655846	CAHABA VALLEY CREEK AT CROSS CR RD AT PELHAM, AL.
02423555	21655896	CAHABA RIVER NEAR HELENA AL
02423571	21654348	SHADES CREEK AT ELDER ST NEAR SPRINGDALE AL
02423586	21655410	SHADES CREEK NR HOMEWOOD, ALA
02423630	21655740	SHADES CREEK NEAR GREENWOOD AL
02423647	21658214	CAHABA RIVER NEAR WEST BLOCTON AL
02424000	21661814	CAHABA RIVER AT CENTREVILLE AL
02425000	21662336	CAHABA RIVER NEAR MARION JUNCTION AL
02427250	21457950	PINE BARREN CREEK NEAR SNOW HILL, AL.
02428400	18239649	ALABAMA RIVER AT CLAIBORNE L&D NEAR MONROEVILLE
02430085	18693151	RED BUD CREEK NR MOORES MILL, MS
02430161	18696273	TENN-TOM WATERWAY BL MONTGOMERY L&D NR FULTON, MS
02430626	18705175	TENN-TOM WATERWAY BL RANKIN L&D NR FULTON, MS
02430680	18693479	TWENTYMILE CREEK NR GUNTOWN, MS
02430880	18694277	CUMMINGS CREEK NR FULTON, MS
02431000	18696047	TOMBIGBEE RIVER NR FULTON, MS
02431011	18696351	TENN-TOM WATERWAY BL FULTON L&D NR FULTON, MS
02432500	18696119	BULL MOUNTAIN CREEK AT TREMONT, MS
02433151	18696449	TENN-TOM WATERWAY BL WILKINS L&D NR SMITHVILLE, MS
02433496	18696487	TENN-TOM WATERWAY BL AMORY L&D AT AMORY, MS
02433500	18696205	TOMBIGBEE RIVER AT BIGBEE, MS
02435020	18681950	TOWN CREEK AT EASON BOULEVARD AT TUPELO, MS
02436500	18683048	TOWN CREEK NR NETTLETON, MS
02437000	18697191	TOMBIGBEE RIVER NR AMORY, MS
02437100	18698547	TOMBIGBEE RIVER AT ABERDEEN LOCK AND DAM, MS
02438000	18670534	BUTTAHATCHEE RIVER BELOW HAMILTON AL
02439400	18673952	BUTTAHATCHEE RIVER NR ABERDEEN, MS
02441300	18659916	CATALPA CREEK AT MAYHEW, MS
02441390	18698745	TOMBIGBEE RIVER AT STENNIS LOCK AND DAM, MS
02443500	18648624	LUXAPALLILA CREEK NR COLUMBUS, MS
02444160	18631042	TOMBIGBEE RIVER AT BEVILL L&D NR PICKENSVILLE, AL
02446500	166759201	SIPSEY RIVER NR ELROD, AL
02447025	18634030	TOMBIGBEE R AT HEFLIN L&D NR GAINESVILLE, AL
02448000	18602182	NOXUBEE RIVER AT MACON, MS
02448500	18604196	NOXUBEE RIVER NR GEIGER, AL
02448900	18604744	BODKA CREEK NEAR GEIGER, AL.
02449838	18588458	DUCK RIVER ABOVE HWY 278 NEAR BERLIN, AL
02449882	18588844	BLUE SPRINGS CREEK NEAR BLOUNTSVILLE, AL.
02450000	18590788	MULBERRY FORK NEAR GARDEN CITY, AL.
02450180	18590656	MULBERRY FORK NEAR ARKADELPHIA, AL.
02450250	18578829	SIPSEY FORK NEAR GRAYSON AL
02450825	18579837	CLEAR C AT NEW HOPE CHURCH NR POPLAR SPRINGS, AL.
02453000	18591938	BLACKWATER CREEK NEAR MANCHESTER AL
02453500	18592074	MULBERRY FORK AT CORDOVA AL
02454055	18591758	LOST CREEK ABOVE PARRISH, AL.
02455000	18563487	LOCUST FORK NEAR CLEVELAND, AL.
02455185	18565189	BLACKBURN FORK LITTLE WARRIOR R NR HOLLY SPRINGS
02455980	18565735	TURKEY CREEK AT SEWAGE PLANT NEAR PINSON AL
02456000	18566313	TURKEY CREEK AT MORRIS AL
02456500	18566317	LOCUST FORK AT SAYRE, AL.
02457000	18566065	FIVEMILE CREEK AT KETONA AL
02457595	18566081	FIVEMILE CREEK NEAR REPUBLIC, AL
02457704	18565921	FIVE MILE CREEK NR SAYRE, ALA
02458148	18566151	VILLAGE CREEK AT 86TH ST NORTH AT ROEBUCK, AL.
02458190	18566335	TRIB TO VILLAGE CREEK AT 50th ST IN BIRMINGHAM
02458300	18566197	VILLAGE CREEK AT 24TH ST. AT BIRMINGHAM, AL
02458502	18566201	VILLAGE CREEK NEAR PRATT CITY, ALABAMA
02458600	18566179	VILLAGE CREEK NEAR DOCENA, ALABAMA
02460500	18567389	VILLAGE CREEK NEAR ADAMSVILLE, AL.
02461130	18223461	VALLEY CREEK AT CENTER ST AT BIRMINGHAM, AL
02461192	18225339	VALLEY CREEK AT AVE W NEAR ENSLEY, AL
02461405	18225411	VALLEY CREEK BELOW BRIGHTON, ALA
02461500	18225427	VALLEY CREEK NEAR BESSEMER, AL
02462000	18229157	VALLEY CREEK NEAR OAK GROVE AL
02464000	18229143	NORTH RIVER NEAR SAMANTHA AL
02464146	18227533	TURKEY CREEK NEAR TUSCALOOSA
02465000	18229923	BLACK WARRIOR RIVER AT NORTHPORT AL
02465292	18206880	CRIBBS MILL CREEK AT WW PLANT AT TUSCALOOSA, AL.
02465493	18208346	ELLIOTTS CREEK AT MOUNDVILLE AL
02466030	18215736	BLACK WARRIOR RIVER AT SELDEN L & D NEAR EUTAW, AL
02467000	18540822	TOMBIGBEE R AT DEMOPOLIS L&D NEAR COATOPA, AL.
02467500	18531726	SUCARNOOCHEE RIVER AT LIVINGSTON AL
02469525	18546646	TOMBIGBEE RIVER NEAR NANAFALIA, AL.
02469761	18548516	TOMBIGBEE R AT COFFEEVILLE L&D NR COFFEEVILLE, AL.
02469800	21640642	SATILPA CREEK NEAR COFFEEVILLE AL
02470072	21638314	BASSETT CREEK AT US HIGHWAY 43 NR THOMASVILLE, AL.
02471001	18523647	CHICKASAW CREEK NEAR KUSHLA AL
02471078	18515610	FOWL RIVER AT HALF-MILE RD NEAR LAURENDINE, AL.
02472000	18154237	LEAF RIVER NR COLLINS, MS
02472500	18157053	BOUIE CREEK NR HATTIESBURG, MS
02472850	18156447	OKATOMA CREEK AT SANFORD, MS
02473000	18135826	LEAF RIVER AT HATTIESBURG, MS
02473460	18130568	TALLAHALA CREEK AT WALDRUP, MS
02473500	18131446	TALLAHALA CREEK AT LAUREL, MS
02474500	18135774	TALLAHALA CREEK NR RUNNELSTOWN, MS
02474560	18135958	LEAF RIVER NR NEW AUGUSTA, MS
02475000	18134412	LEAF RIVER NR MCLAIN, MS
02475500	18194859	CHUNKY RIVER NR CHUNKY, MS
02476500	166759312	SOWASHEE CREEK AT MERIDIAN, MS
02476600	18195359	OKATIBBEE CREEK AT ARUNDEL, MS
02477000	18178477	CHICKASAWHAY RIVER AT ENTERPRISE, MS
02477500	18182257	CHICKASAWHAY RIVER NR WAYNESBORO, MS
02478500	18172814	CHICKASAWHAY RIVER AT LEAKESVILLE, MS
02479000	18121032	PASCAGOULA RIVER AT MERRILL, MS
02479130	18105054	BLACK CREEK NR BROOKLYN, MS
02479155	18105412	CYPRESS CREEK NR JANICE, MS
02479300	18107248	RED CREEK AT VESTRY, MS
02479310	18121240	PASCAGOULA RIVER AT GRAHAM FERRY, MS
02479560	18094981	ESCATAWPA RIVER NEAR AGRICOLA MS
02479945	18094191	BIG CREEK AT COUNTY RD 63 NEAR WILMER, AL.
02479980	18094345	CROOKED CREEK NEAR FAIRVIEW, AL.
02480002	18095029	HAMILTON CREEK AT SNOW ROAD NEAR SEMMES, AL.
02481000	18070104	BILOXI RIVER AT WORTHAM, MS
02481510	18075806	WOLF RIVER NR LANDON, MS
02481880	15785080	PEARL RIVER AT BURNSIDE, MS
02481984	15786248	BEASHA CREEK NEAR COLDWATER, MS
02482000	15785502	PEARL RIVER AT EDINBURG, MS
02482470	15784730	LOBUTCHA CREEK AT RENFROE, MS
02482550	15788288	PEARL RIVER NR CARTHAGE, MS
02483000	15787182	TUSCOLAMETA CREEK AT WALNUT GROVE, MS
02483500	15788348	PEARL RIVER NR LENA, MS
02484000	15780454	YOCKANOOKANY RIVER NR KOSCIUSKO, MS
02484500	15786158	YOCKANOOKANY RIVER NR OFAHOMA, MS
02484600	15748338	COFFEE BOGUE AT LUDLOW, MS
02484760	15748460	FANNEGUSHA CREEK NR SAND HILL, MS
02485498	15750940	PELAHATCHIE CREEK AT STATE HWY 25 NR FANNIN, MS
02485700	15758118	HANGING MOSS CREEK NR JACKSON, MS
02485735	15758306	PEARL RIVER AT HWY 25 AT JACKSON, MS
02486000	15758318	PEARL RIVER AT JACKSON, MS
02486100	15756778	LYNCH CREEK AT JACKSON, MS
02487500	15759818	STRONG RIVER AT D`LO, MS
02488000	15737433	PEARL RIVER AT ROCKPORT, MS
02488500	15737587	PEARL RIVER NR MONTICELLO, MS
02489000	15702833	PEARL RIVER NR COLUMBIA, MS
02489500	15708443	Pearl River near Bogalusa, LA
02490500	15687631	BOGUE CHITTO NR TYLERTOWN, MS
02492000	15690765	Bogue Chitto River near Bush, LA
02492110	15720689	EAST PEARL RIVER AB WILSON SL AT WALKIAH BLUFF, MS
02492111	933180299	WILSON SLOUGH NEAR WALKIAH BLUFF, MS
02492343	15707813	EAST HOBOLOCHITTO CREEK NR CAESAR, MS
02492360	15707325	WEST HOBOLOCHITTO CREEK NR MCNEILL, MS
02492620	15714395	PEARL RIVER AT NSTL STATION, MS
03007800	8972788	Allegheny River at Port Allegany, PA
03010500	8974256	Allegheny River at Eldred, PA
03010655	8971150	Oswayo Creek at Shinglehouse, PA
03010820	8969946	ALLEGHENY RIVER AT OLEAN NY
03011020	8969860	ALLEGHENY RIVER AT SALAMANCA NY
03011800	8974366	Kinzua Creek near Guffey, PA
03012550	8975664	Allegheny River at Kinzua Dam, PA
03014500	15445117	CHADAKOIN RIVER AT FALCONER NY
03015000	15445645	Conewango Creek at Russell, PA
03015310	8975690	Allegheny River bl Conewango Creek at Warren, PA
03015500	8975242	Brokenstraw Creek at Youngsville, PA
03016000	10220190	Allegheny River at West Hickory, PA
03017500	10220060	Tionesta Creek at Lynch, PA
03020000	10222370	Tionesta Creek at Tionesta Creek Dam, PA
03020500	10222114	Oil Creek at Rouseville, PA
03021350	9049227	French Creek near Wattsburg, PA
03021520	9050757	French Creek near Union City, PA
03022540	9052485	Woodcock Creek at Blooming Valley, PA
03022554	9052441	Woodcock Creek at Woodcock Creek Dam, PA
03023100	9053093	French Creek at Meadville, PA
03024000	9053487	French Creek at Utica, PA
03025500	10222194	Allegheny River at Franklin, PA
03026480	6873503	East Branch Clarion River near Clermont, PA
03026500	6874093	Sevenmile Run near Rasselas, PA
03027500	6874115	EB Clarion River at EB Clarion River Dam, PA
03028000	6874111	West Branch Clarion River at Wilcox, PA
03028500	6874629	Clarion River at Johnsonburg, PA
03029000	6874893	Clarion River at Ridgway, PA
03029500	6877193	Clarion River at Cooksburg, PA
03030500	6877295	Clarion River near Piney, PA
03031500	4745955	Allegheny River at Parker, PA
03031882	4738065	Redbank Creek at Brookville, PA
03032500	4741683	Redbank Creek at St. Charles, PA
03034000	4741709	Mahoning Creek at Punxsutawney, PA
03034500	4741771	Little Mahoning Creek at McCormick, PA
03036000	166808422	Mahoning Creek at Mahoning Creek Dam, PA
03036500	4742165	Allegheny River at Kittanning, PA
03038000	4741899	Crooked Creek at Idaho, PA
03039000	4741239	Crooked Creek at Crooked Creek Dam near Ford City
03040000	4753658	Stonycreek River at Ferndale, PA
03041000	4753644	Little Conemaugh River at East Conemaugh, PA
03041029	4753772	Conemaugh River at Minersville, PA
03041500	4754886	Conemaugh River at Seward, PA
03042000	4754050	Blacklick Creek at Josephine, PA
03042280	4752350	Yellow Creek near Homer City, PA
03042500	4752366	Two Lick Creek at Graceton, PA
03044000	4754924	Conemaugh River at Tunnelton, PA
03044810	4582730	Linn Run at Linn Run State Park near Rector, PA
03045000	4582480	Loyalhanna Creek at Kingston, PA
03047000	4583044	Loyalhanna Creek at Loyalhanna Dam, PA
03048500	4581930	Kiskiminetas River at Vandergrift, PA
03048900	11049850	Buffalo Creek at Iron Bridge, PA
03049000	11049880	Buffalo Creek near Freeport, PA
03049500	11049994	Allegheny River at Natrona, PA
03049800	11049744	Little Pine Creek near Etna, PA
03050000	4353002	TYGART VALLEY RIVER NEAR DAILEY, WV
03051000	4351512	TYGART VALLEY RIVER AT BELINGTON, WV
03052000	4352070	MIDDLE FORK RIVER AT AUDRA, WV
03052120	4353810	BUCKHANNON RIVER AT ALTON, WV
03052500	4354466	SAND RUN NEAR BUCKHANNON, WV
03053500	4352064	BUCKHANNON RIVER AT HALL, WV
03054500	4352178	TYGART VALLEY RIVER AT PHILIPPI, WV
03056000	4352134	TYGART VALLEY R AT TYGART DAM NR GRAFTON, WV
03056250	4350794	THREE FORK CREEK NR GRAFTON, WV
03057000	4352082	TYGART VALLEY RIVER AT COLFAX, WV
03058000	3717136	WEST FORK R BL STONEWALL JACKSON DAM NR WESTON, WV
03058500	3716762	WEST FORK RIVER AT BUTCHERVILLE, WV
03058975	3716188	WEST FORK RIVER NEAR MOUNT CLARE, WV
03061000	3715602	WEST FORK RIVER AT ENTERPRISE, WV
03061500	3769770	BUFFALO CREEK AT BARRACKVILLE, WV
03062235	3769806	MONONGAHELA RIVER AT FLAGGY MEADOW, WV
03062500	3768536	DECKERS CREEK AT MORGANTOWN, WV
03065000	3775187	DRY FORK AT HENDRICKS, WV
03065400	3775587	BLACKWATER RIVER NEAR DAVIS, WV
03066000	3775599	BLACKWATER RIVER AT DAVIS, WV
03067510	3777215	SHAVERS FORK NR CHEAT BRIDGE, WV
03068800	3776515	SHAVERS FORK BELOW BOWDEN, WV
03069500	3775993	CHEAT RIVER NEAR PARSONS, WV
03070260	3775649	CHEAT RIVER AT ALBRIGHT, WV
03070500	3773681	BIG SANDY CREEK AT ROCKVILLE, WV
03072000	3787957	Dunkard Creek at Shannopin, PA
03072655	3788105	Monongahela River near Masontown, PA
03073000	3789647	South Fork Tenmile Creek at Jefferson, PA
03074500	3787171	Redstone Creek at Waltersburg, PA
03075070	3785895	Monongahela River at Elizabeth, PA
03075500	3809533	YOUGHIOGHENY RIVER NEAR OAKLAND, MD
03075825	3808879	NORTH GLADE RUN NEAR SWANTON, MD
03075905	3808623	CHERRY CREEK AT STATE PARK ROAD NEAR MCHENRY, MD
03076100	3808859	YOUGHIOGHENY RIVER NEAR MCHENRY, MD
03076500	3808497	YOUGHIOGHENY RIVER AT FRIENDSVILLE, MD
03076600	3808829	BEAR CREEK AT FRIENDSVILLE, MD
03077500	3809037	Youghiogheny River at Youghiogheny River Dam, PA
03078000	3808365	CASSELMAN RIVER AT GRANTSVILLE, MD
03079000	3808745	Casselman River at Markleton, PA
03080000	3808755	Laurel Hill Creek at Ursina, PA
03081000	3809023	Youghiogheny River below Confluence, PA
03081500	3808977	Youghiogheny River at Ohiopyle, PA
03082500	3806299	Youghiogheny River at Connellsville, PA
03083500	3806147	Youghiogheny River at Sutersville, PA
03085500	3823985	Chartiers Creek at Carnegie, PA
03086000	3821223	Ohio River at Sewickley, PA
03090500	13156389	Mahoning River bl Berlin Dam nr Berlin Center OH
03091500	13154265	Mahoning River at Pricetown OH
03092460	13156205	West Branch Mahoning River at Wayland OH
03093000	13154221	Eagle Creek at Phalanx Station OH
03094000	13154725	Mahoning River at Leavittsburg OH
03094704	13154163	Mosquito Creek near Greene Center OH
03095500	13153121	Mosquito Creek bl Mosquito Ck Dam nr Cortland OH
03098600	13153643	Mahoning River above West Ave at Youngstown OH
03099500	13154299	Mahoning River at Lowellville OH
03101500	12997122	Shenango River at Pymatuning Dam, PA
03102500	12998878	Little Shenango River at Greenville, PA
03102850	12997756	Shenango River near Transfer, PA
03103500	12999322	Shenango River at Sharpsville, PA
03105500	19464300	Beaver River at Wampum, PA
03106000	10926401	Connoquenessing Creek near Zelienople, PA
03106300	10926383	Muddy Creek near Portersville, PA
03106500	10925875	Slippery Rock Creek at Wurtemburg, PA
03107500	19464254	Beaver River at Beaver Falls, PA
03107698	3820579	Traverse Creek near Kendall, PA
03108000	3820883	Raccoon Creek at Moffatts Mill, PA
03109500	3819547	Little Beaver Creek near East Liverpool OH
03110000	3820543	Yellow Creek near Hammondsville OH
03110830	3822659	KINGS CREEK AT WEIRTON, WV
03111200	19451765	Dunkle Run near Claysville, PA
03111500	19453023	Short Creek near Dillonvale OH
03111548	19452479	Wheeling Creek below Blaine OH
03111675	19454497	Job Creek at Delphene, PA
03111955	19453867	WHEELING CREEK NEAR MAJORSVILLE, WV
03112000	19452609	WHEELING CREEK AT ELM GROVE, WV
03113990	19454103	Captina Creek at S.R. 148 at Armstrongs Mills OH
03114306	15429794	OHIO RIVER ABOVE SARDIS, OH
03114500	15431972	MIDDLE ISLAND CREEK AT LITTLE, WV
03115400	15431680	Little Muskingum River at Bloomfield OH
03115644	15431096	East Fork Duck Creek near Harrietsville OH
03115712	15431000	West Fork Duck Creek at Macksburg OH
03115786	15431824	Duck Creek below Whipple OH
03115917	19386588	Tuscarawas River above Barberton OH
03116000	19387736	Tuscarawas River at Clinton OH
03116077	19387554	Chippewa Creek at Miller Rd at Sterling OH
03117000	19389648	Tuscarawas River at Massillon OH
03117500	19388778	Sandy Creek at Waynesburg OH
03118000	19388196	Middle Branch Nimishillen Creek at Canton OH
03118500	19389766	Nimishillen Creek at North Industry OH
03120500	19392430	McGuire Creek near Leesville OH
03121500	19390010	Indian Fork bl Atwood Dam near New Cumberland OH
03124500	19389138	Sugar Creek at Strasburg OH
