08067250	1515433	Trinity Rv at IH 10 nr Wallisville, TX
08067500	1558738	Cedar Bayou nr Crosby, TX
08067525	1558800	Goose Ck at Baytown, TX
08067548	1465746	W Fk San Jacinto Rv nr Huntsville, TX
08067650	1467944	W Fk San Jacinto Rv bl Lk Conroe nr Conroe, TX
08067690	1467916	Lake Ck nr Dobbin, TX
08067920	1468038	Lake Ck at Sendera Ranch Rd nr Conroe, TX
08068000	1468280	W Fk San Jacinto Rv nr Conroe, TX
08068090	1468106	W Fk San Jacinto Rv abv Lk Houston nr Porter, TX
08068275	1508047	Spring Ck nr Tomball, TX
08068310	1508275	Spring Ck at Kuykendahl Rd, The Woodlands, TX
08068325	1508279	Willow Ck nr Tomball, TX
08068390	1508263	Bear Br at Research Blvd, The Woodlands, TX
08068400	1507967	Panther Br at Gosling Rd, The Woodlands, TX
08068450	1508045	Panther Br nr Spring, TX
08068500	1508043	Spring Ck nr Spring, TX
08068720	1509241	Cypress Ck at Katy-Hockley Rd nr Hockley, TX
08068740	1509209	Cypress Ck at House-Hahl Rd nr Cypress, TX
08068780	1508121	Little Cypress Ck nr Cypress, TX
08068800	1509175	Cypress Ck at Grant Rd nr Cypress, TX
08068900	1508295	Cypress Ck at Stuebner-Airline Rd nr Westfield, TX
08069000	1508289	Cypress Ck nr Westfield, TX
08069500	1468442	W Fk San Jacinto Rv nr Humble, TX
08070000	1520007	E Fk San Jacinto Rv nr Cleveland, TX
08070200	1520083	E Fk San Jacinto Rv nr New Caney, TX
08070500	1520249	Caney Ck nr Splendora, TX
08071000	1520237	Peach Ck at Splendora, TX
08071280	1520091	Luce Bayou abv Lk Houston nr Huffman, TX
08072050	1440433	San Jacinto Rv nr Sheldon, TX
08072300	1440311	Buffalo Bayou nr Katy, TX
08072600	1439269	Buffalo Bayou at State Hwy 6 nr Addicks, TX
08072680	1440261	S Mayde Ck at Heathergold Dr nr Addicks, TX
08072730	1440237	Bear Ck nr Barker, TX
08072760	1440211	Langham Ck at W Little York Rd nr Addicks, TX
08073100	1440289	Langham Ck at Addicks Res Outflow nr Addicks, TX
08073500	1439317	Buffalo Bayou nr Addicks, TX
08073600	1439357	Buffalo Bayou at W Belt Dr, Houston, TX
08073700	1439377	Buffalo Bayou at Piney Point, TX
08074020	1438725	Whiteoak Bayou at Alabonson Rd, Houston, TX
08074150	1440227	Cole Ck at Deihl Rd, Houston, TX
08074250	1440245	Brickhouse Gully at Costa Rica St, Houston, TX
08074500	1440291	Whiteoak Bayou at Houston, TX
08074540	1439229	Little Whiteoak Bayou at Trimble St, Houston, TX
08074760	1439495	Brays Bayou at Alief, TX
08074800	1440395	Keegans Bayou at Roark Rd nr Houston, TX
08074810	1439635	Brays Bayou at Gessner Dr, Houston, TX
08075000	1440385	Brays Bayou at Houston, TX
08075400	1439761	Sims Bayou at Hiram Clarke St, Houston, TX
08075500	1439685	Sims Bayou at Houston, TX
08075730	1440389	Vince Bayou at Pasadena, TX
08075763	1439055	Hunting Bayou at Hoffman St, Houston, TX
08075770	1440277	Hunting Bayou at IH 610, Houston, TX
08075780	1438277	Greens Bayou at Cutten Rd nr Houston, TX
08075900	1438283	Greens Bayou nr US Hwy 75 nr Houston, TX
08076000	1440183	Greens Bayou nr Houston, TX
08076180	1438379	Garners Bayou nr Humble, TX
08076500	1438737	Halls Bayou at Houston, TX
08076997	1562342	Clear Ck at Mykawa St nr Pearland, TX
08077600	1563092	Clear Ck nr Friendswood, TX
08078000	1566188	Chocolate Bayou nr Alvin, TX
08079510	13718559	N Fk DMF Brazos Rv at Loop 289 nr Lubbock, TX
08079600	13698835	DMF Brazos Rv at Justiceburg, TX
08080500	13700459	DMF Brazos Rv nr Aspermont, TX
08080505	13700695	DMF Brazos Rv nr Rule, TX
08080700	13676139	Running Water Draw at Plainview, TX
08082000	14033905	Salt Fk Brazos Rv nr Aspermont, TX
08082500	5539988	Brazos Rv at Seymour, TX
08082700	5542148	Millers Ck nr Munday, TX
08083100	5488917	Clear Fk Brazos Rv nr Roby, TX
08083230	5488375	Clear Fk Brazos Rv nr Noodle, TX
08083235	5489405	Clear Fk Brazos Rv at FM 3116 nr Anson, TX
08083240	5489939	Clear Fk Brazos Rv at Hwy 83 nr Hawley, TX
08083420	5491645	Cat Claw Ck at Abilene, TX
08083430	5489503	Elm Ck at Abilene, TX
08083480	5491439	Cedar Ck at IH 20, Abilene, TX
08084000	5489397	Clear Fk Brazos Rv at Nugent, TX
08084200	5489963	Clear Fk Brazos Rv at Lueders, TX
08084800	5509690	California Ck nr Stamford, TX
08085500	5521636	Clear Fk Brazos Rv at Ft Griffin, TX
08086050	5525639	Deep Ck at Moran, TX
08086212	5525607	Hubbard Ck bl Albany, TX
08086290	5525073	Big Sandy Ck abv Breckenridge, TX
08086500	5526143	Hubbard Ck nr Breckenridge, TX
08088000	5494668	Brazos Rv nr South Bend, TX
08088610	24943191	Brazos Rv nr Graford, TX
08089000	5497132	Brazos Rv nr Palo Pinto, TX
08090800	5498058	Brazos Rv nr Dennis, TX
08090905	5499434	Brazos Rv ds Lk Granbury nr Granbury, TX
08091000	5512484	Brazos Rv nr Glen Rose, TX
08091500	5512008	Paluxy Rv at Glen Rose, TX
08092000	5512092	Nolan Rv at Blum, TX
08093100	5513718	Brazos Rv nr Aquilla, TX
08093360	166414852	Aquilla Ck abv Aquilla, TX
08094800	5530672	N Bosque Rv at Hico, TX
08095000	5531532	N Bosque Rv nr Clifton, TX
08095200	5531474	N Bosque Rv at Valley Mills, TX
08095300	5523936	Middle Bosque Rv nr McGregor, TX
08095400	5523974	Hog Ck nr Crawford, TX
08096500	5513784	Brazos Rv at Waco, TX
08098290	5555562	Brazos Rv nr Highbank, TX
08098300	5555300	Little Pond Ck nr Burlington, TX
08099100	2567762	Leon Rv nr De Leon, TX
08099300	2567906	Sabana Rv nr De Leon, TX
08099382	2568024	Copperas Ck at FM 2247 nr Comanche, TX
08099500	2569756	Leon Rv nr Hasse, TX
08100000	2569332	Leon Rv nr Hamilton, TX
08100500	2572206	Leon Rv at Gatesville, TX
08101000	2580511	Cowhouse Ck at Pidcoke, TX
08102500	2572116	Leon Rv nr Belton, TX
08102595	2572260	Nolan Ck at S Penelope, Belton, TX
08103800	5586798	Lampasas Rv nr Kempner, TX
08103900	5587890	S Fk Rocky Ck nr Briggs, TX
08103940	5588558	Lampasas Rv at Ding Dong, TX
08104100	5587556	Lampasas Rv nr Belton, TX
08104300	5588596	Salado Ck at Salado, TX
08104500	5592244	Little Rv nr Little River, TX
0810464660	5670825	N Fk San Gabriel Rv at Reagan Blvd nr Leander, TX
08104700	5670899	N Fk San Gabriel Rv nr Georgetown, TX
08104900	5671579	S Fk San Gabriel Rv at Georgetown, TX
08105095	5670841	Berry Ck at Airport Rd nr Georgetown, TX
08105505	5670779	Willis Ck nr Granger, TX
08105700	5670795	San Gabriel Rv at Laneport, TX
08105872	5671619	Brushy Ck at Cedar Park, TX
08105883	5671189	Brushy Ck at IH 35, Round Rock, TX
08105886	5673157	Lake Ck at Lake Ck Pkwy nr Austin, TX
08105888	5671187	Brushy Ck at Kenney Fort Blvd at Round Rock, TX
08106050	5671175	Brushy Ck at FM 619 nr Taylor, TX
08106350	5592482	Little Rv nr Rockdale, TX
08106500	5593118	Little Rv nr Cameron, TX
08107950	5591642	N Elm Ck at Rosebud Rd nr Meeks, TX
08108250	5593046	Big Elm Ck at SH 77 nr Cameron, TX
08108700	5558060	Brazos Rv at SH 21 nr Bryan, TX
08108780	5557042	Little Brazos Rv at FM 485 nr Hearne, TX
08109700	5570395	Middle Yegua Ck nr Dime Box, TX
08109800	5570253	E Yegua Ck nr Dime Box, TX
08110000	5570685	Yegua Ck nr Somerville, TX
08110100	5570225	Davidson Ck nr Lyons, TX
08110200	5559374	Brazos Rv at Washington, TX
08110325	5575031	Navasota Rv abv Groesbeck, TX
08110430	5574947	Big Ck nr Freestone, TX
08110500	5575763	Navasota Rv nr Easterly, TX
08110800	5577121	Navasota Rv at Old San Antonio Rd nr Bryan, TX
08111500	3121538	Brazos Rv nr Hempstead, TX
08111700	3122466	Mill Ck nr Bellville, TX
08111850	3122690	Brazos Rv at San Felipe, TX
08114000	3123784	Brazos Rv at Richmond, TX
08114100	3123790	Brazos Rv nr Sugar Land, TX
08115000	3124582	Big Ck nr Needville, TX
08116400	3123676	Dry Ck nr Rosenberg, TX
08116650	3124642	Brazos Rv nr Rosharon, TX
08116850	3124654	Brazos Rv nr West Columbia, TX
08117370	1605410	San Bernard Rv nr Chesterville, TX
08117500	1607520	San Bernard Rv nr Boling, TX
08117705	1607586	San Bernard Rv nr Sweeny, TX
08117995	5633401	Colorado Rv nr Gail, TX
08119500	5633425	Colorado Rv at Hwy 350 nr Ira, TX
08120500	5633615	Deep Ck nr Dunn, TX
08121000	5635847	Colorado Rv at Colorado City, TX
08123800	5714835	Beals Ck nr Westbrook, TX
08123850	5721925	Colorado Rv abv Silver, TX
08124000	5722265	Colorado Rv at Robert Lee, TX
08126380	5654720	Colorado Rv nr Ballinger, TX
08127000	5656750	Elm Ck at Ballinger, TX
08128000	5702807	S Concho Rv at Christoval, TX
08128400	5707852	Middle Concho Rv abv Tankersley, TX
08129300	5702767	Spring Ck abv Tankersley, TX
08130500	5702799	Dove Ck at Knickerbocker, TX
08130700	5702879	Spring Ck abv Twin Buttes Res nr San Angelo, TX
08131400	5702253	Pecan Ck nr San Angelo, TX
08132450	5702757	Red Arroyo at S. Chadbourne St. nr San Angelo, TX
08133250	5711103	N Concho Rv abv Sterling City, TX
08133500	5711823	N Concho Rv at Sterling City, TX
08134000	5711941	N Concho Rv nr Carlsbad, TX
08134250	5712411	N Concho Rv nr Grape Creek, TX
08136000	5719546	Concho Rv at San Angelo, TX
08136500	5718784	Concho Rv at Paint Rock, TX
08136700	5727563	Colorado Rv nr Stacy, TX
08138000	5727613	Colorado Rv at Winchell, TX
08140700	5735207	Pecan Bayou nr Cross Cut, TX
08140860	5741572	Jim Ned Ck at CR 140 nr Coleman, TX
08142000	5741912	Hords Ck nr Coleman, TX
08143500	5736533	Pecan Bayou at Brownwood, TX
08143600	5736179	Pecan Bayou nr Mullin, TX
08144500	5747704	San Saba Rv at Menard, TX
08144600	5745336	San Saba Rv nr Brady, TX
08145000	5753504	Brady Ck at Brady, TX
08146000	5746512	San Saba Rv at San Saba, TX
08147000	5756726	Colorado Rv nr San Saba, TX
08148500	5761759	N Llano Rv nr Junction, TX
08149900	5765175	S Llano Rv at Flat Rock Ln at Junction, TX
08150000	5770577	Llano Rv nr Junction, TX
08150700	5769807	Llano Rv nr Mason, TX
08150800	5770545	Beaver Ck nr Mason, TX
08151500	5771725	Llano Rv at Llano, TX
08152000	5757354	Sandy Ck nr Kingsland, TX
08152900	5785479	Pedernales Rv nr Fredericksburg, TX
08153500	5786075	Pedernales Rv nr Johnson City, TX
08154700	5781189	Bull Ck at Loop 360 nr Austin, TX
08155200	5781265	Barton Ck at SH 71 nr Oak Hill, TX
08155240	5781325	Barton Ck at Lost Ck Blvd nr Austin, TX
08155300	5781337	Barton Ck at Loop 360, Austin, TX
08155400	5781711	Barton Ck abv Barton Spgs at Austin, TX
08155541	5781709	W Bouldin Ck at Oltorf Rd, Austin, TX
08156675	5781223	Shoal Ck at Silverway Dr, Austin, TX
08156800	5781703	Shoal Ck at W 12th St, Austin, TX
08157560	5781313	Waller Ck at E 1st St, Austin, TX
08158000	5781917	Colorado Rv at Austin, TX
08158035	5781319	Boggy Ck at Webberville Rd, Austin, TX
08158045	5781291	Ft Br Boggy Ck at Manor Rd, Austin, TX
08158200	5781217	Walnut Ck at Dessau Rd, Austin, TX
08158380	5781203	Little Walnut Ck at Georgian Dr, Austin, TX
08158600	5781285	Walnut Ck at Webberville Rd, Austin, TX
08158700	5780099	Onion Ck nr Driftwood, TX
08158810	5781401	Bear Ck bl FM 1826 nr Driftwood, TX
08158813	5781417	Bear Ck at Spillar Ranch Rd nr Manchaca, TX
08158827	5781431	Onion Ck at Twin Creeks Rd nr Manchaca, TX
08158840	5781373	Slaughter Ck at FM 1826 nr Austin, TX
08158860	5781407	Slaughter Ck at FM 2304 nr Austin, TX
08158920	5781345	Williamson Ck at Oak Hill, TX
08158927	5781353	Kincheon Br at William Cannon Blvd, Austin, TX
08158970	5781731	Williamson Ck at Jimmy Clay Rd, Austin, TX
08159000	5781369	Onion Ck at US Hwy 183, Austin, TX
08159105	5789124	Eastern Trib to Dry Ck nr Del Valle, TX
08159110	5788864	Western Trib to Gilleland Ck nr Manor, TX
08159200	5790218	Colorado Rv at Bastrop, TX
08159250	5789336	Maha Ck at Von Quintus Rd nr Del Valle, TX
08159500	5790058	Colorado Rv at Smithville, TX
08160400	5791848	Colorado Rv abv La Grange, TX
08160800	5791670	Redgate Ck nr Columbus, TX
08161000	5791934	Colorado Rv at Columbus, TX
08162000	3764246	Colorado Rv at Wharton, TX
08162500	3765768	Colorado Rv nr Bay City, TX
08162501	3766368	Colorado Rv nr Wadsworth, TX
08162600	9355362	Tres Palacios Rv nr Midfield, TX
08163500	7841703	Lavaca Rv at Hallettsville, TX
08164000	7842827	Lavaca Rv nr Edna, TX
08164300	7846049	Navidad Rv nr Hallettsville, TX
08164350	7846241	Navidad Rv nr Speaks, TX
08164370	7846357	Navidad Rv at Morales, TX
08164390	7846429	Navidad Rv at Strane Pk nr Edna, TX
08164450	7846335	Sandy Ck nr Ganado, TX
08164503	7846391	W Mustang Ck nr Ganado, TX
08164504	7846399	E Mustang Ck nr Louise, TX
08164600	9349285	Garcitas Ck nr Inez, TX
08164800	9349455	Placedo Ck nr Placedo, TX
08165300	3585678	N Fk Guadalupe Rv nr Hunt, TX
08165500	3586192	Guadalupe Rv at Hunt, TX
08166000	3585554	Johnson Ck nr Ingram, TX
08166140	3585626	Guadalupe Rv abv Bear Ck at Kerrville, TX
08166200	3585724	Guadalupe Rv at Kerrville, TX
08166250	3587616	Guadalupe Rv nr Center Point, TX
08167000	3589508	Guadalupe Rv at Comfort, TX
08167200	3589062	Guadalupe Rv at FM 474 nr Bergheim, TX
08167500	3589120	Guadalupe Rv nr Spring Branch, TX
08167800	1619595	Guadalupe Rv at Sattler, TX
08168500	1620031	Guadalupe Rv abv Comal Rv at New Braunfels, TX
08168797	1619663	Dry Comal Ck at Loop 337 nr New Braunfels, TX
08168932	1619647	Comal Rv (nc) nr Landa Lk, New Braunfels, TX
08169000	1619649	Comal Rv at New Braunfels, TX
08169500	1619653	Guadalupe Rv at New Braunfels, TX
08169740	1620831	Guadalupe Rv at Hwy 123-BR at Seguin, TX
08169792	1620877	Guadalupe Rv at FM 1117 nr Seguin, TX
08169845	1622735	Guadalupe Rv at CR 143 nr Gonzales, TX
08170500	1631099	San Marcos Rv at San Marcos, TX
08170800	1628111	Blanco Rv at Crabapple Rd nr Blanco, TX
08170890	1628229	Little Blanco Rv at FM 32 nr Fischer, TX
08170950	1628253	Blanco Rv at Fischer Store Rd nr Fischer, TX
08171000	1630223	Blanco Rv at Wimberley, TX
08171290	1629555	Blanco Rv at Halifax Rch nr Kyle, TX
08171300	1631023	Blanco Rv nr Kyle, TX
08171350	1631129	Blanco Rv at San Marcos, TX
08171400	1631195	San Marcos Rv nr Martindale, TX
08172000	1631387	San Marcos Rv at Luling, TX
08172400	1631087	Plum Ck at Lockhart, TX
08173000	1631587	Plum Ck nr Luling, TX
08173900	1622713	Guadalupe Rv at Gonzales, TX
08174200	1620735	Sandy Fork Ck at Hwy 97 nr Waelder, TX
08174550	1620703	Peach Ck at Hwy 90 nr Waelder, TX
08174600	1622763	Peach Ck bl Dilworth, TX
08174700	1623075	Guadalupe Rv at Hwy 183 nr Hochheim, TX
08175000	1623207	Sandies Ck nr Westhoff, TX
08175800	1637447	Guadalupe Rv at Cuero, TX
08176500	1639225	Guadalupe Rv at Victoria, TX
08176550	1638505	Fifteenmile Ck nr Weser, TX
08176900	1638559	Coleto Ck at Arnold Rd Crsg nr Schroeder, TX
08177300	1639209	Perdido Ck at FM 622 nr Fannin, TX
08177500	1638907	Coleto Ck nr Victoria, TX
08177520	1640519	Guadalupe Rv nr Bloomington, TX
08177700	10840810	Olmos Ck at Dresden Dr, San Antonio, TX
08178050	10840818	San Antonio Rv at Mitchell St, San Antonio, TX
08178500	10840824	San Pedro Ck at Furnish St, San Antonio, TX
08178565	10840502	San Antonio Rv at Loop 410, San Antonio, TX
08178593	10840230	Salado Ck at Blanco Rd, San Antonio, TX
08178700	10840232	Salado Ck at Loop 410, San Antonio, TX
08178800	10840488	Salado Ck at Loop 13, San Antonio, TX
0817887350	10834470	Medina Rv at Patterson Rd at Medina, TX
08178880	10833740	Medina Rv at Bandera, TX
08178980	10834916	Medina Rv abv English Crsg nr Pipe Creek, TX
08179110	10834936	Red Bluff Ck at FM 1283 nr Pipe Creek, TX
08180500	10836370	Medina Rv nr Riomedina, TX
08180586	10835018	San Geronimo Ck nr Helotes, TX
08180640	10836382	Medina Rv at La Coste, TX
08180700	10835974	Medina Rv nr Macdona, TX
08180800	10836104	Medina Rv nr Somerset, TX
08181400	10835030	Helotes Ck at Helotes, TX
08181480	10836388	Leon Ck at IH 35, San Antonio, TX
08181500	10836420	Medina Rv at San Antonio, TX
08181725	10840558	San Antonio Rv nr Braunig Lk nr Elmendorf, TX
08181800	10840572	San Antonio Rv nr Elmendorf, TX
08183200	3836053	San Antonio Rv nr Floresville, TX
08183500	3838221	San Antonio Rv nr Falls City, TX
08183900	7850595	Cibolo Ck nr Boerne, TX
08184050	7850613	Cibolo Ck at Smithson Valley Rd nr Bulverde, TX
08185000	7851041	Cibolo Ck at Selma, TX
08185065	7850687	Cibolo Ck nr Saint Hedwig, TX
08185100	7851629	Martinez Ck nr Saint Hedwig, TX
08185500	7851771	Cibolo Ck at Sutherland Springs, TX
08186000	7852265	Cibolo Ck nr Falls City, TX
08186500	3838999	Ecleto Ck nr Runge, TX
08187500	3839263	Escondido Ck at Kenedy, TX
08188060	3839167	San Antonio Rv at SH 72 nr Runge, TX
08188500	3840125	San Antonio Rv at Goliad, TX
08188570	3840137	San Antonio Rv nr McFaddin, TX
08188800	1640227	Guadalupe Rv nr Tivoli, TX
08188810	1643099	Guadalupe Rv at SH 35 nr Tivoli, TX
08189200	3159657	Copano Ck nr Refugio, TX
08189300	5289427	Medio Ck nr Beeville, TX
08189500	5289461	Mission Rv at Refugio, TX
08189700	5297631	Aransas Rv nr Skidmore, TX
0818999010	7869629	Nueces Rv nr Barksdale, TX
08189998	7869281	Nueces Rv at CR 414 at Montell, TX
08190000	7872253	Nueces Rv at Laguna, TX
08190500	7876116	W Nueces Rv nr Brackettville, TX
08192000	10892689	Nueces Rv bl Uvalde, TX
08193000	10893541	Nueces Rv nr Asherton, TX
08194000	10630401	Nueces Rv at Cotulla, TX
08194200	10634531	San Casimiro Ck nr Freer, TX
08194500	10631613	Nueces Rv nr Tilden, TX
08195000	10645755	Frio Rv at Concan, TX
08196000	10644541	Dry Frio Rv nr Reagan Wells, TX
08197500	10646917	Frio Rv bl Dry Frio Rv nr Uvalde, TX
08197936	10644091	Sabinal Rv bl Mill Ck nr Vanderpool, TX
08198000	10645747	Sabinal Rv nr Sabinal, TX
08198500	10646003	Sabinal Rv at Sabinal, TX
08200000	10654651	Hondo Ck nr Tarpley, TX
08200720	10655685	Hondo Ck at SH 173 nr Hondo, TX
08200977	10653947	Middle Verde Ck at SH 173 nr Bandera, TX
08201500	10653905	Seco Ck at Miller Rh nr Utopia, TX
08202700	10655687	Seco Ck at Rowe Rh nr D'Hanis, TX
08204005	10646939	Leona Rv nr Uvalde, TX
08205500	10661028	Frio Rv nr Derby, TX
08206600	10664196	Frio Rv at Tilden, TX
08206700	10671061	San Miguel Ck nr Tilden, TX
08206910	10664160	Choke Canyon Res OWC nr Three Rivers, TX
08207500	10827864	Atascosa Rv nr McCoy, TX
08208000	10828654	Atascosa Rv at Whitsett, TX
08210000	3168766	Nueces Rv nr Three Rivers, TX
08210400	3168874	Lagarto Ck nr George West, TX
08211000	3170312	Nueces Rv nr Mathis, TX
08211200	3171770	Nueces Rv at Bluntzer, TX
08211500	3171902	Nueces Rv at Calallen, TX
08211520	1636035	Oso Ck at Corpus Christi, TX
08211800	1653097	San Diego Ck at Alice, TX
08211900	1653465	San Fernando Ck at Alice, TX
08212300	1655121	Tranquitas Ck at Kingsville, TX
08212400	1585173	Los Olmos Ck nr Falfurrias, TX
08212820	1584123	Petronila Ck at FM 665 nr Driscoll, TX
08217500	17906689	RIO GRANDE AT WAGON WHEEL GAP, CO
08220000	17906875	RIO GRANDE NEAR DEL NORTE, CO
08227000	17880874	SAGUACHE CREEK NEAR SAGUACHE, CO
08252500	17863228	COSTILLA CREEK ABOVE COSTILLA DAM, NM
08253000	17863226	CASIAS CREEK NEAR COSTILLA, NM
08253500	17863236	SANTISTEVAN CREEK NEAR COSTILLA, NM
08254000	17861934	COSTILLA CREEK BELOW COSTILLA DAM, NM
08255500	17863212	COSTILLA CREEK NEAR COSTILLA, NM
08261000	17863208	COSTILLA CREEK NEAR GARCIA, CO
08263500	17863292	RIO GRANDE NEAR CERRO, NM
08265000	17862454	RED RIVER NEAR QUESTA, NM
08266820	17862548	RED RIVER BELOW FISH HATCHERY, NEAR QUESTA, NM
08267500	17863440	RIO HONDO NEAR VALDEZ, NM
08269000	17864360	RIO PUEBLO DE TAOS NEAR TAOS, NM
08271000	17863078	RIO LUCERO NEAR ARROYO SECO, NM
08275500	17865290	RIO GRANDE DEL RANCHO NEAR TALPA, NM
08276300	17864480	RIO PUEBLO DE TAOS BELOW LOS CORDOVAS, NM
08276500	17864594	RIO GRANDE BLW TAOS JUNCTION BRIDGE NEAR TAOS, NM
08277470	17864778	RIO PUEBLO NR PENASCO, NM
08279000	17865320	EMBUDO CREEK AT DIXON, NM
08279500	17864756	RIO GRANDE AT EMBUDO, NM
08281400	17844466	RIO CHAMA ABOVE CHAMA, NM
08282300	17843682	RIO BRAZOS AT FISHTAIL ROAD NR TIERRA AMARILLA, NM
08284100	165886202	RIO CHAMA NEAR LA PUENTE, NM
08285500	17844046	RIO CHAMA BELOW EL VADO DAM, NM
08286500	17846526	RIO CHAMA ABOVE ABIQUIU RESERVOIR, NM
08287000	17846986	RIO CHAMA BELOW ABIQUIU DAM, NM
08289000	17846406	RIO OJO CALIENTE AT LA MADERA, NM
08290000	17848906	RIO CHAMA NEAR CHAMITA, NM
08291000	17866714	SANTA CRUZ RIVER NEAR CUNDIYO, NM
08294195	17866812	RIO NAMBE ABOVE NAMBE FALLS DAM NEAR NAMBE, NM
08294210	17866820	RIO NAMBE BELOW NAMBE FALLS DAM NEAR NAMBE, NM
08302500	17866900	TESUQUE CREEK ABOVE DIVERSIONS NEAR SANTA FE, NM
08308050	17866890	RIO TESUQUE BELOW DIVERSIONS NEAR SANTA FE, NM
08313000	17865930	RIO GRANDE AT OTOWI BRIDGE, NM
08313350	17833378	RITO DE LOS FRIJOLES IN BANDELIER NAT MON, NM
08315480	17835114	SANTA FE RIVER ABOVE MCCLURE RES, NR SANTA FE, NM
08316000	17835116	SANTA FE RIVER NEAR SANTA FE, NM
08317200	17834098	SANTA FE RIVER ABOVE COCHITI LAKE, NM
08317400	17834678	RIO GRANDE BELOW COCHITI DAM, NM
08317950	17835524	GALISTEO CREEK BELOW GALISTEO DAM, NM
08319000	17836174	RIO GRANDE AT SAN FELIPE, NM
08324000	17826714	JEMEZ RIVER NEAR JEMEZ, NM
08328950	17828666	JEMEZ RIVER OUTLET BELOW JEMEZ CANYON DAM, NM
08329000	17828478	JEMEZ RIVER BELOW JEMEZ CANYON DAM, NM
08329835	17806324	N. FLOODWAY CHANNEL AT ALBUQUERQUE, NM
08329870	17806268	BEAR ARROYO AT JEFFERSON ST AT ALBQ, NM
08329900	17806166	NORTH FLOODWAY CHANNEL NEAR ALAMEDA, NM
08329918	17819084	RIO GRANDE AT ALAMEDA BRIDGE AT ALAMEDA, NM
08329928	17806852	RIO GRANDE NR ALAMEDA, NM
08330000	17819068	RIO GRANDE AT ALBUQUERQUE, NM
08330600	17806546	TIJERAS ARROYO NR ALBUQUERQUE, NM
08330875	17808622	RIO GRANDE AT ISLETA LAKES NR ISLETA, NM
08331160	943020262	RIO GRANDE NEAR BOSQUE FARMS, NM
08331510	24796186	RIO GRANDE AT STATE HWY 346 NEAR BOSQUE, NM
08332010	17811950	RIO GRANDE FLOODWAY NEAR BERNARDO, NM
08334000	17795246	RIO PUERCO ABV ARROYO CHICO NR GUADALUPE, NM
08340500	17789879	ARROYO CHICO NR GUADALUPE, NM
08343000	17772765	RIO SAN JOSE AT GRANTS, NM
08343500	17773345	RIO SAN JOSE AT ACOMA PUEBLO, NM
08353000	943020235	RIO PUERCO NEAR BERNARDO, NM
08354900	17811742	RIO GRANDE FLOODWAY AT SAN ACACIA, NM
08355050	17810814	RIO GRANDE AT BRIDGE NEAR ESCONDIDA, NM
08355490	943020292	RIO GRANDE ABOVE US HWY 380 NR SAN ANTONIO, NM
08358300	943020332	RIO GRANDE CONVEYANCE CHANNEL AT SAN MARCIAL, NM
08358400	17813236	RIO GRANDE FLOODWAY AT SAN MARCIAL, NM
08359500	17727284	RIO GRANDE AT NARROWS IN ELEPHANT BUTTE RES., NM
08361000	3222059	RIO GRANDE BELOW ELEPHANT BUTTE DAM, NM
08364000	1131000010	RIO GRANDE AT EL PASO, TX
08371500	308621	Rio Grande abv Rio Conchos nr Presidio, TX
08374200	281390	Rio Grande bl Rio Conchos nr Presidio, TX
08374550	291639	Rio Grande nr Castolon, TX
08375300	1131000968	Rio Grande at Rio Grande Village, Big Bnd NP, TX
08376300	299935	Sanderson Ck at Sanderson, TX
08377200	285292	Rio Grande at Foster Rh nr Langtry, TX
08377900	20815146	RIO MORA NEAR TERRERO, NM
08378500	20815180	PECOS RIVER NEAR PECOS, NM
08379500	20816582	PECOS RIVER NEAR ANTON CHICO, NM
08380500	20815196	GALLINAS CREEK NEAR MONTEZUMA, NM
08382000	20815744	GALLINAS RIVER NEAR LOURDES, NM
08382500	20817726	GALLINAS R NR COLONIAS, NM
08382600	20817526	PECOS R ABV CANON DEL UTA NR COLONIAS, NM
08382650	20817728	PECOS RIVER ABOVE SANTA ROSA LAKE, NM
08382830	20817606	PECOS RIVER BELOW SANTA ROSA DAM, NM
08383500	20818412	PECOS RIVER NEAR PUERTO DE LUNA, NM
08384500	20800875	PECOS RIVER BELOW SUMNER DAM, NM
08385000	20800887	FORT SUMNER MAIN CANAL NEAR FORT SUMNER, NM
08385522	20803573	PECOS RIVER BELOW TAIBAN CREEK NEAR FORT SUMNER,NM
08385630	20803203	PECOS RIVER NEAR DUNLAP, NM
08386000	20779308	PECOS RIVER NEAR ACME, NM
08386505	20772466	RIO RUIDOSO AT RUIDOSO, NM
08387000	20772484	RIO RUIDOSO AT HOLLYWOOD, NM
08387550	20773110	NORTH FORK EAGLE CREEK NEAR ALTO, NM
08387575	20773118	SOUTH FORK EAGLE CREEK NEAR ALTO, NM
08390020	20773124	RIO HONDO ABOVE CHAVEZ CANYON NEAR HONDO, NM
08390500	20774462	RIO HONDO AT DIAMOND A RANCH NR ROSWELL, NM
08390800	20774512	RIO HONDO BLW DIAMOND A DAM NR ROSWELL, NM
08393610	20773700	RIO HONDO NEAR ROSWELL, NM
08394024	20780960	PECOS R N BOUNDARY (BLM WETLANDS) NR DEXTER, NM
08394033	20781952	PECOS R S BOUNDARY (BLM WETLANDS) NR DEXTER, NM
08394500	20766191	RIO FELIX AT OLD HWY BRD NR HAGERMAN, NM
08395500	20783756	PECOS RIVER NEAR LAKE ARTHUR, NM
08396500	20784350	PECOS RIVER NEAR ARTESIA, NM
08397600	22421196	RIO PENASCO NEAR DUNKEN, NM
08397620	22421466	RIO PENASCO NEAR HOPE, NM
08398500	22423332	RIO PENASCO AT DAYTON, NM
08399500	22454933	PECOS RIVER (KAISER CHANNEL) NEAR LAKEWOOD, NM
08400000	22455973	FOURMILE DRAW NR LAKEWOOD, NM
08401200	22455359	SOUTH SEVEN RIVERS NR LAKEWOOD, NM
08401500	22455531	PECOS RIVER BELOW BRANTLEY DAM NEAR CARLSBAD, NM
08401900	22455729	ROCKY ARROYO AT HWY BRD NR CARLSBAD, NM
08402000	22455677	PECOS R AT DAMSITE 3 NR CARLSBAD, NM
08404000	22457393	PECOS RIVER BELOW AVALON DAM, NM
08405105	22458323	DARK CANYON DRAW NEAR WHITES CITY, NM
08405150	22457719	DARK CANYON AT CARLSBAD, NM
08405200	22457637	PECOS RIVER BELOW DARK CANYON AT CARLSBAD, NM
08405350	22458799	BLACK RIVER BELOW BLUE SPRINGS NR WHITES CITY, NM
08405400	22458531	BLACK RIVER AT HARKEY CROSSING NR MALAGA, NM
08405450	22458801	BLUE SPRINGS ABOVE DIVERSIONS NR WHITES CITY, NM
08405500	22458537	BLACK RIVER ABOVE MALAGA, NM
08406000	22458517	BLACK RIVER AT MALAGA, NM
08406500	22458621	PECOS RIVER NEAR MALAGA, NM
08407000	22460369	PECOS RIVER AT PIERCE CANYON CROSSING, NM
08407500	22459435	PECOS RIVER AT RED BLUFF, NM
08408500	20758520	DELAWARE RIVER NR RED BLUFF, NM
08412500	3210721	Pecos Rv nr Orla, TX
08419000	943070051	Pecos Rv at FM 3398 nr Pecos, TX
08433000	20749139	Barrilla Draw nr Saragosa, TX
08437710	3212475	Pecos Rv at RR 1776 nr Grandfalls, TX
08446500	3213331	Pecos Rv nr Girvin, TX
08447000	332712	Pecos Rv nr Sheffield, TX
08447020	3158167	Independence Ck nr Sheffield, TX
08447300	333056	Pecos Rv at Brotherton Rh nr Pandale, TX
08447410	334022	Pecos Rv nr Langtry, TX
08449000	12095655	Devils Rv nr Juno, TX
08449100	12096273	Dolan Ck abv Devils River nr Comstock, TX
08456310	318261	Las Moras Spgs Dws of pool at Brackettville,TX
08458995	606903	Zacate Ck at Laredo, TX
08462500	1131002601	Rio Grande at Roma, TX
08477110	17703137	MIMBRES RIVER AT MIMBRES, NM
08480595	20850229	SALT CREEK NEAR TULAROSA, NM
08481500	20851387	TULAROSA CREEK NEAR BENT, NM
08484550	20851659	LOST RIVER NEAR HOLLOMAN AIR FORCE BASE, NM
09010500	1234461	COLORADO RIVER BELOW BAKER GULCH NR GRAND LAKE, CO
09014050	1234531	GRAND LAKE OUTLET BLW CHIPMUNK LN AT GRAND LK, CO
09015000	1234501	COLORADO RIVER BL SHADOW MOUNTAIN RESERVOIR, CO.
09019000	1234505	COLORADO RIVER BELOW LAKE GRANBY, CO.
09019500	1234513	COLORADO RIVER NEAR GRANBY, CO
